year,name,category,description,url,num_projects,projects_url,contact_email,mailing_list,irc_channel,twitter_url,blog_url,topics,technologies
2019,FreeBSD,Operating systems,FreeBSD: The Foundation of the Internet,https://www.FreeBSD.org/,6,https://summerofcode.withgoogle.com/archive/2019/organizations/6504969929228288/,mailto:soc-admins@FreeBSD.org,https://lists.freebsd.org/mailman/listinfo/freebsd-hackers,https://wiki.freebsd.org/SummerOfCode/IRC,https://twitter.com/freebsd,,"virtualization, security, embedded systems, cloud, kernel","c/c++, llvm, assembly, shell script, make"
2019,FreeType,Media,FreeType font rendering library,https://freetype.org,3,https://summerofcode.withgoogle.com/archive/2019/organizations/6561043747176448/,,https://lists.nongnu.org/mailman/listinfo/freetype-devel,,,,"graphics, rendering, fonts, opentype, truetype","c, python, gnu make, gnu autotools, fonts"
2019,freifunk,Social and communication,Freifunk is a non-commercial initiative for free and open wireless networks.,https://freifunk.net,10,https://summerofcode.withgoogle.com/archive/2019/organizations/6609278192844800/,mailto:gsoc-org-admins@freifunk.net,https://lists.freifunk.net/mailman/listinfo/wlanware-freifunk.net,http://irc.freifunk.net,https://twitter.com/freifunk,https://blog.freifunk.net,"web apps, embedded systems, software defined networking, network, wireless communications","c, python, ruby, openwrt, html/css/js"
2019,"Genes, Genomes and Variation",Science and medicine,Authoritative databases of genome sequences and their function,http://www.ensembl.org,3,https://summerofcode.withgoogle.com/archive/2019/organizations/4535509118877696/,mailto:helpdesk@ensembl.org,http://lists.ensembl.org/mailman/listinfo/dev,,https://twitter.com/ensembl,http://www.ensembl.info/,"databases, genomics, scientific visualization, data analysis","python, mysql, javascript, perl, rest"
2019,GENIVI Alliance,Other,Developing open software for IVI and the connected car.,https://www.genivi.org,2,https://summerofcode.withgoogle.com/archive/2019/organizations/5661409025720320/,mailto:gandersson@genivi.org,https://lists.genivi.org/mailman/listinfo/genivi-projects_lists.genivi.org,,,,"embedded systems, graphics, automotive, communication, bigdata","yocto, embedded, automotive, some/ip"
2019,Gentoo Foundation,Operating systems,"A flexible, source-based Linux distribution.",http://www.gentoo.org,2,https://summerofcode.withgoogle.com/archive/2019/organizations/4508206280212480/,mailto:gentoo-soc@lists.gentoo.org,https://wiki.gentoo.org/wiki/Google_Summer_of_Code/2019/Application_Guidelines,https://wiki.gentoo.org/wiki/Google_Summer_of_Code/2019/Application_Guidelines,https://twitter.com/gentoo,http://planet.gentoo.org/,"operating systems, embedded systems, package management, init systems, application security","python, c/c++, shell script, linux kernel, bash"
2019,Git,Programming languages,"fast, scalable, distributed revision control system",http://git-scm.com,2,https://summerofcode.withgoogle.com/archive/2019/organizations/6548634445807616/,mailto:git@vger.kernel.org,http://git-scm.com/community,http://git-scm.com/community,,,"dvcs, version-control","c, shell, git"
2019,Global Alliance for Genomics and Health,Science and medicine,We develop open standards and tools for genomics to benefit human health,https://www.ga4gh.org/,5,https://summerofcode.withgoogle.com/archive/2019/organizations/6722565253365760/,mailto:gsoc@genomicsandhealth.org,,,https://twitter.com/ga4gh,https://www.ga4gh.org/news/,"web, genomics, bioinformatics, genetics, standards","java, mongodb, spring"
2019,GNOME,Operating systems,The elegant and ethical desktop experience,https://www.gnome.org/,8,https://summerofcode.withgoogle.com/archive/2019/organizations/6458159500099584/,,https://mail.gnome.org/mailman/listinfo/desktop-devel-list,https://wiki.gnome.org/Community/GettingInTouch/IRC,https://twitter.com/gnome,https://planet.gnome.org,"desktop, operating system, design, end user application, application","c, python, javascript, rust, gtk+"
2019,GNSS-SDR,Science and medicine,An open source Global Navigation Satellite Systems software-defined receiver,https://gnss-sdr.org/,3,https://summerofcode.withgoogle.com/archive/2019/organizations/6369884148072448/,,http://lists.sourceforge.net/lists/listinfo/gnss-sdr-developers,,,,"gnss, geolocation, navigation, software defined radio, communications","c/c++, c++17, sdr, gnss, c++ libraries c++11 c++14 c++17 c++20"
2019,GNU Compiler Collection,Programming languages,A set of compilers produced by the GNU project,https://gcc.gnu.org/,6,https://summerofcode.withgoogle.com/archive/2019/organizations/4808868352229376/,mailto:gcc@gcc.gnu.org,https://gcc.gnu.org/lists.html,https://gcc.gnu.org/wiki/GCConIRC,https://twitter.com/gnutools,,"compilers, toolchain, openmp","c/c++, gnu autotools"
2019,GNU Mailman,End user applications,the GNU Mailing List Manager,http://list.org,1,https://summerofcode.withgoogle.com/archive/2019/organizations/5170270925488128/,mailto:mailman-developers@python.org,https://mail.python.org/mailman3/lists/mailman-developers.python.org/,https://webchat.freenode.net/?channels=#mailman,,,email,"django, python 3, rest, email"
2019,GNU Octave,Programming languages,Free Your Numbers,http://www.octave.org,0,https://summerofcode.withgoogle.com/archive/2019/organizations/6521761976287232/,mailto:octave-maintainers@gnu.org,https://lists.gnu.org/mailman/listinfo/octave-maintainers,https://webchat.freenode.net/?channels=#octave,,http://planet.octave.org/,"mathematics, scientific computing, numerical computation, numerical methods, matlab","c++, hg"
2019,GNU Radio,Science and medicine,GNU Radio: The free & open software radio ecosystem.,https://www.gnuradio.org/,2,https://summerofcode.withgoogle.com/archive/2019/organizations/6350475543183360/,,https://wiki.gnuradio.org/index.php/MailingLists,https://www.gnuradio.org/about/,https://twitter.com/gnuradio,https://www.gnuradio.org/blog/,"software defined radio, radar, digital signal processing, software radio, wireless communications","python, android, c++, qt"
2019,Godot Engine,Media,Multi-platform fully-featured 2D and 3D game engine,https://godotengine.org,8,https://summerofcode.withgoogle.com/archive/2019/organizations/4692174627667968/,mailto:gsoc@godotengine.org,,https://godotengine.org/community,https://twitter.com/godotengine,https://godotengine.org/news,"graphics, real time, cross-platform, game engine, game development","opengl, github, c++, cpp, gdscript"
2019,gprMax,Science and medicine,Simulating electromagnetic wave propagation for Ground Penetrating Radar,http://www.gprmax.com,2,https://summerofcode.withgoogle.com/archive/2019/organizations/5844947004030976/,mailto:info@gprmax.com,https://groups.google.com/forum/?hl=en-GB#!forum/gprmax,,https://twitter.com/gprMax_fdtd,,"science, engineering, geophysics, electromagnetics, ground penetrating radar","python, cython, cuda, openmp, mpi"
2019,Haiku,Operating systems,Integrated operating system for personal computers,http://www.haiku-os.org,1,https://summerofcode.withgoogle.com/archive/2019/organizations/4805982134206464/,mailto:pulkomandy@gmail.com,https://www.haiku-os.org/community/ml,https://www.haiku-os.org/community/irc,https://twitter.com/haikuOS,https://www.haiku-os.org/blog/,"desktop, graphics, kernel, drivers, filesystems","c++, arm, x86, posix, unix"
2019,Haskell.Org,Programming languages,"Standardized, statically typed, lazy functional programming language",http://haskell.org,15,https://summerofcode.withgoogle.com/archive/2019/organizations/6049761981890560/,mailto:committee@haskell.org,https://mail.haskell.org/mailman/listinfo/haskell-cafe,https://summer.haskell.org/contact.html,https://twitter.com/haskellorg,https://summer.haskell.org/news.html,"education, compilers, haskell, functional programming, build tools","haskell, ghc, cabal, codeworld, servant"
2019,Hydra Ecosystem,Web,Automate REST APIs. Next generation API clients.,https://www.hydraecosystem.org/,2,https://summerofcode.withgoogle.com/archive/2019/organizations/5054921525690368/,mailto:hydraecosystem@googlegroups.com,https://groups.google.com/d/forum/hydraecosystem,https://gitter.im/HTTP-APIs/Lobby,,https://medium.com/w3c-hydra-development-community,"web, api, semantic web, hydra, docker","python, javascript, redis, flask, sql"
2019,INCF,Science and medicine,Advancing global collaborative brain research,https://www.incf.org/,17,https://summerofcode.withgoogle.com/archive/2019/organizations/5347624150892544/,mailto:info@incf.org,,,https://twitter.com/INCForg,,"science, big data, neuroscience, brain modelling, bio/neuro image processing","python, javascript, c++, xml, jupyter"
2019,Inkscape,Media,"Inkscape is a professional vector graphics editor for Windows, Mac OS X & Linux.",http://www.inkscape.org/,1,https://summerofcode.withgoogle.com/archive/2019/organizations/5818074534510592/,mailto:inkscape-devel@lists.sf.net,http://lists.sourceforge.net/mailman/listinfo/inkscape-devel,https://inkscape.org/community/discussion/,https://twitter.com/inkscape,,vector graphics,"python, gtk, c++11, css, svg"
2019,Institut für Angewandte Informatik (InfAI) e.V.,Media,Putting scientific research into practice.,https://infai.org,1,https://summerofcode.withgoogle.com/archive/2019/organizations/4934728610742272/,mailto:softvis@uni-leipzig.de,,,https://twitter.com/softvisresearch,http://softvis.wifa.uni-leipzig.de,"virtual reality, software quality, visualization, software analytics, web","javascript, java, a-frame, neo4j, htc vive"
2019,Intel Media And Audio For Linux,Media,Intel Media And Audio For Linux,https://01.org/linuxmedia,2,https://summerofcode.withgoogle.com/archive/2019/organizations/4612056525832192/,mailto:zhong.li@intel.com,https://lists.01.org/mailman/listinfo/intel-vaapi-media,https://01.org/linuxmedia/blogs/seanvk/2017/vaapi-media-consolidation,,https://01.org/linuxmedia/blogs,"video processing, audio firmware, hardware accelerated media processing, video framework, video decoding/encoding","audio, gstreamer, video, ffmpeg, hardware acceleration"
2019,InterMine,Science and medicine,"Integrating biological data sources, making it easy to query and analyse data",http://intermine.org/,6,https://summerofcode.withgoogle.com/archive/2019/organizations/6502123104108544/,mailto:info@intermine.org,https://intermine.readthedocs.io/en/latest/support/mailing-list/,http://chat.intermine.org/,https://twitter.com/intermineorg/,https://intermineorg.wordpress.com/,"web, open science, bioinformatics, biology, data visualisation","python, javascript, java, clojure, r"
2019,Internet Archive,Other,Universal Access to All Knowledge,https://archive.org,2,https://summerofcode.withgoogle.com/archive/2019/organizations/5931882041049088/,mailto:iagsoc2019@gmail.com,,,https://twitter.com/internetarchive,http://blog.archive.org,"library, archive, web archives","python, javascript, node.js, php, elasticsearch"
2019,Internet Systems Consortium,Other,We support the infrastructure of the Internet with Open Source,https://isc.org,1,https://summerofcode.withgoogle.com/archive/2019/organizations/6473524057735168/,mailto:info@isc.org,https://lists.isc.org,,https://twitter.com/ISCdotORG,https://www.isc.org/community/blogs/,"networking, internet, infrastructure, dhcp, dns","python, mysql, javascript, c/c++, c99"
2019,JabRef,End user applications,The open-source reference manager,http://www.jabref.org/,1,https://summerofcode.withgoogle.com/archive/2019/organizations/5195087733063680/,mailto:developers@jabref.org,http://discourse.jabref.org/,https://gitter.im/JabRef/jabref,https://twitter.com/jabref_org,https://blog.jabref.org/,"academia, reference manager, bibtex, pdf","java, javafx, latex"
2019,JBoss Community,Programming languages,Community of Java projects around JBoss Middleware,http://www.jboss.org/,8,https://summerofcode.withgoogle.com/archive/2019/organizations/6481976553373696/,,https://developer.jboss.org/wiki/JBossGSoCContactInformation,https://developer.jboss.org/wiki/JBossGSoCContactInformation,,,"database, cloud, kubernetes, codeuino","java, react, golang"
2019,JdeRobot - Universidad Rey Juan Carlos,Other,A software toolkit for developing applications in Robotics and Computer Vision,http://jderobot.org,6,https://summerofcode.withgoogle.com/archive/2019/organizations/4962509264519168/,mailto:jderobot@gmail.com,http://jderobot.org/Community#Questions_and_support,,https://twitter.com/jderobot,,"education, robotics, computer vision, developer tools","python, c/c++, ros, gazebo, opencv"
2019,Jenkins project,Programming languages,Open-source automation server for building great things at any scale,http://jenkins.io,5,https://summerofcode.withgoogle.com/archive/2019/organizations/4658407594786816/,mailto:jenkinsci-gsoc-all-public@googlegroups.com,https://jenkins.io/projects/gsoc/#contacts,https://gitter.im/jenkinsci/gsoc-sig,https://twitter.com/jenkinsci,https://jenkins.io/blog/,"developer tools, automation, continuous integration, continuous delivery, devops","javascript, java, machine learning, docker, kubernetes"
2019,Joomla,Web,"Joomla, the flexible platform empowering website creators.",https://www.joomla.org/,3,https://summerofcode.withgoogle.com/archive/2019/organizations/6743345328553984/,mailto:gsoc@opensourcematters.org,https://www.joomla.org/mailing-lists.html,https://glip.com/joomla,https://twitter.com/joomla/,https://community.joomla.org/,"web, programming languages, web application, web development, cms","mysql, javascript, php, html/css, cms"
2019,JSK Robotics Laboratory / The University of Tokyo,Science and medicine,JSK is focusing on the fundamental functions & systems for intelligent robots,http://www.jsk.t.u-tokyo.ac.jp/,0,https://summerofcode.withgoogle.com/archive/2019/organizations/5987024522182656/,mailto:k-okada+gsoc@jsk.imi.i.u-tokyo.ac.jp,,,,,"robotics, ros","ros, lisp"
2019,Kapitan,Programming languages,Generic templated configuration management for kubernetes and more,https://github.com/deepmind/kapitan,1,https://summerofcode.withgoogle.com/archive/2019/organizations/6263521917009920/,mailto:kapitan-discuss@googlegroups.com,https://groups.google.com/d/forum/kapitan-discuss,,,https://kapitan.dev/,"cloud, kubernetes","python, kubernetes, jsonnet, jinja2, terraform"
2019,KDE Community,End user applications,Experience Freedom!,https://www.kde.org/,22,https://summerofcode.withgoogle.com/archive/2019/organizations/6750932035960832/,mailto:kde-community@kde.org,https://mail.kde.org/mailman/listinfo/kde-devel,https://userbase.kde.org/IRC_Channels,https://twitter.com/kdecommunity,https://planetkde.org/,"privacy, education, science, desktop application, deskstop","c++, qt, qt5"
2019,Kiwix,End user applications,Internet content for people without internet access,https://www.kiwix.org,2,https://summerofcode.withgoogle.com/archive/2019/organizations/5778289111597056/,mailto:gsoc@kiwix.org,,http://webchat.freenode.net/?channels=#kiwix,https://twitter.com/KiwixOffline,https://wikimediafoundation.org/?s=kiwix,offline access,"python, javascript, android, java, c++"
2019,KNIME,Data,Open for Innovation,https://knime.com,2,https://summerofcode.withgoogle.com/archive/2019/organizations/6612711935311872/,mailto:academia@knime.com,,,https://twitter.com/knime,,"machine learning, data science, deep learning, image processing, data analytics","javascript, java, tensorflow"
2019,Kodi Foundation,End user applications,The ultimate entertainment center,http://www.kodi.tv,1,https://summerofcode.withgoogle.com/archive/2019/organizations/4913612756353024/,mailto:contact@kodi.tv,,https://kodi.wiki/view/Kodi_related_projects_and_sites,https://twitter.com/kodiTv,https://kodi.tv/blog,"games, audio, video, media","python, mysql, c++, ffmpeg, sqlite"
2019,LabLua,Programming languages,Programming Languages Research with emphasis on the Lua language,http://www.lua.inf.puc-rio.br/,5,https://summerofcode.withgoogle.com/archive/2019/organizations/4943100659630080/,mailto:lablua@inf.puc-rio.br,http://groups.google.com/group/labluagsoc,,,,"scripting languages, reactive programming, kernel scripting","lua, céu"
2019,Libre Space Foundation,Science and medicine,Open-source software and hardware technologies for space,https://libre.space,2,https://summerofcode.withgoogle.com/archive/2019/organizations/6088409171361792/,mailto:info@libre.space,https://community.libre.space/,https://libre.space/community/,https://twitter.com/librespace_fnd,https://libre.space/category/updates/,"hardware, web applications, space applications, software defined radio, cubesats","python, django, c/c++, arduino, raspberry pi"
2019,LibreHealth,Science and medicine,Healthcare for Humanity,https://librehealth.io,0,https://summerofcode.withgoogle.com/archive/2019/organizations/4948859590017024/,,https://forums.librehealth.io/gsoc,https://chat.librehealth.io/channels/gsoc,https://twitter.com/LibreHealthIO,,"web apps, ictd, health, global health, medicine","mysql, javascript, java, webcomponents"
2019,LibreOffice,End user applications,LibreOffice is a free and open source office suite.,https://www.libreoffice.org,6,https://summerofcode.withgoogle.com/archive/2019/organizations/6381024487931904/,mailto:libreoffice@lists.freedesktop.org,https://wiki.documentfoundation.org/Development/Mailing_List,https://wiki.documentfoundation.org/Website/IRC,https://twitter.com/libreoffice,https://blog.documentfoundation.org/,"office suite, desktop application, android, end user application","python, java, c++"
2019,Libvirt,Infrastructure and cloud,virtualization abstraction library,https://libvirt.org/,3,https://summerofcode.withgoogle.com/archive/2019/organizations/4556574457069568/,mailto:libvirt-users@redhat.com,https://libvirt.org/contact.html#email,https://libvirt.org/contact.html#irc,,http://planet.virt-tools.org/,"virtualization, cloud, libraries, virtual machine","c, python, xen, kvm, virtualization"
2019,Linkerd,Infrastructure and cloud,Ultralight service mesh for Kubernetes and beyond,https://linkerd.io,2,https://summerofcode.withgoogle.com/archive/2019/organizations/6364232440872960/,mailto:thomas@buoyant.io,https://lists.cncf.io/g/cncf-linkerd-users,https://linkerd.io/2/get-involved/,https://twitter.com/linkerd,https://blog.linkerd.io,"networking, kubernetes, service mesh, cloud native, dev-ops","prometheus, react, rust, golang, kubernetes"
2019,Liquid Galaxy project,Other,Liquid Galaxy delivers panoramic views across multiple displays and computers,https://www.liquidgalaxy.eu,7,https://summerofcode.withgoogle.com/archive/2019/organizations/4783124586692608/,mailto:liquidgalaxylab@gmail.com,,http://liquidgalaxy.slack.com,https://twitter.com/_liquidgalaxy,,"visualization, data, cluster, geo","python, android, nodejs, maps api"
2019,LLVM Compiler Infrastructure,Programming languages,LLVM Compiler Infrastructure,http://llvm.org,8,https://summerofcode.withgoogle.com/archive/2019/organizations/5682474363912192/,mailto:llvm-dev@lists.llvm.org,http://lists.llvm.org/cgi-bin/mailman/listinfo/llvm-dev,http://llvm.org/docs/#irc,,http://blog.llvm.org/,"code analysis, programming languages and development tools, compiler","llvm, clang"
2019,LuaRocks,Programming languages,The Lua package manager and ecosystem,https://luarocks.org,2,https://summerofcode.withgoogle.com/archive/2019/organizations/5012931375267840/,,https://sourceforge.net/p/luarocks/mailman/,https://gitter.im/luarocks/luarocks,https://twitter.com/luarocksorg,,"programming languages, games, package managers",lua
2019,MacPorts,End user applications,Package manager for macOS,https://www.macports.org/,4,https://summerofcode.withgoogle.com/archive/2019/organizations/6180821432532992/,mailto:umeshksingla@macports.org,https://www.macports.org/contact.php#Lists,https://www.macports.org/contact.php#IRC,https://twitter.com/macports,,"operating systems, build tools, libraries, package management, macos","c, python, web, tcl, scripting"
2019,MariaDB Foundation,Data,One of the most popular databases on the web with many notable users,https://mariadb.org,4,https://summerofcode.withgoogle.com/archive/2019/organizations/5215339158175744/,mailto:maria-discuss@lists.launchpad.net,https://mariadb.com/kb/en/mariadb/resources/,https://mariadb.com/kb/en/meta/irc/,https://twitter.com/mariadb_org,https://mariadb.org/blog/,"databases, sql","c, mysql, java, mariadb, c++"
2019,Matrix.org,Social and communication,"An open network for secure, decentralised communication",https://matrix.org,4,https://summerofcode.withgoogle.com/archive/2019/organizations/4888795948777472/,mailto:benp@matrix.org,,https://matrix.to/#/#gsoc:matrix.org,https://twitter.com/matrixdotorg,https://matrix.org/blog/posts,"realtime communications, interoperability, decentralisation, federated","python, postgresql, javascript, go, nodejs"
2019,MBDyn - Multibody Dynamics,Science and medicine,Scientific mechanical simulation tool for engineering research and development,https://www.mbdyn.org/,1,https://summerofcode.withgoogle.com/archive/2019/organizations/6496732601384960/,mailto:mbdyn@aero.polimi.it,http://lists.mbdyn.org/mailman/listinfo/mbdyn-users,,,,"linear algebra, mechanical engineering, aeronautics, multibody dynamics, aerodynamics","python, c++, scripting"
2019,MetaBrainz Foundation Inc,Data,MetaBrainz curates and makes available metadata about music and books.,https://metabrainz.org,6,https://summerofcode.withgoogle.com/archive/2019/organizations/4667145252765696/,mailto:support@metabrainz.org,https://community.metabrainz.org/,https://metabrainz.org/contact,https://twitter.com/metabrainz,https://blog.metabrainz.org,"open data, community, music, metadata, books","python, javascript, react, perl, postgres"
2019,MIT App Inventor,Programming languages,Anyone Can Build Apps That Impact the World,http://appinventor.mit.edu,4,https://summerofcode.withgoogle.com/archive/2019/organizations/5222565591646208/,mailto:appinventor@mit.edu,https://groups.google.com/forum/#!forum/app-inventor-open-source-dev,,https://twitter.com/mitappinventor,http://appinventor.mit.edu/explore/team-blog.html,"education, api, iot, programming languages and development tools, mobile","javascript, android, java, gwt, google app engine"
2019,mlpack,Data,"fast, flexible C++ machine learning library",http://www.mlpack.org,9,https://summerofcode.withgoogle.com/archive/2019/organizations/5934768259072000/,mailto:mlpack@lists.mlpack.org,http://lists.mlpack.org/mailman/listinfo/mlpack,http://webchat.freenode.net/?channels=mlpack,,http://mlpack.org/blog/,"machine learning, data mining, data science, fast algorithms",c++
2019,Moira,Programming languages,Moira is a realtime alerting system based on Graphite data,https://moira.readthedocs.io/,1,https://summerofcode.withgoogle.com/archive/2019/organizations/6751954187845632/,mailto:opensource@skbkontur.ru,,https://t.me/moira_alert,,,"monitoring, devops, devtools, alerting, sre","javascript, golang, grafana, typescript, graphite"
2019,Moodle,Social and communication,Empowering educators to improve our world,https://moodle.org/,2,https://summerofcode.withgoogle.com/archive/2019/organizations/5681434444955648/,mailto:support@moodle.org,https://docs.moodle.org/dev/Moodle_dev_mailing_list,https://telegram.me/moodledev,https://twitter.com/@moodle,https://moodle.com/news/,"education, web applications, e-learning, school system, learning management","javascript, sql, php, angular, ionic"
2019,Mozilla,Web,"The internet for people, not for profit.",https://mozilla.org,14,https://summerofcode.withgoogle.com/archive/2019/organizations/5091266142928896/,mailto:mhoye@mozilla.com,,https://wiki.mozilla.org/IRC,,https://blog.mozilla.org/,"privacy/security, internet freedom, web technologies","python, javascript, react, c++, rust"
2019,MuseScore,End user applications,MuseScore is music notation software used by millions of musicians worldwide,https://musescore.org/,4,https://summerofcode.withgoogle.com/archive/2019/organizations/4748058460422144/,mailto:anatoly-os@musescore.com,http://mscore-developer@lists.sourceforge.net,https://t.me/musescoreeditorchat,https://twitter.com/musescore,,"music, notation, midi, sheet music, composing","c++, qt, cmake"
2019,Named Data Networking Project,Web,A Content-Centric Future Internet architecture,http://named-data.net/,2,https://summerofcode.withgoogle.com/archive/2019/organizations/5873958367264768/,mailto:info@named-data.net,https://named-data.net/codebase/platform/support/mailing-lists/,http://minindn.memphis.edu/ndnslack/,http://twitter.com/nameddata,http://reddit.com/r/ndn,"networking, informationc centric networking, ipfs","javascript, android, java, c++14, c#"
2019,National Resource for Network Biology (NRNB),Science and medicine,Developing open source software to enable network-based biomedical discovery,http://www.nrnb.org/gsoc.html,11,https://summerofcode.withgoogle.com/archive/2019/organizations/6637709450280960/,mailto:alex.pico@gladstone.ucsf.edu,https://groups.google.com/forum/#!forum/cytoscape-helpdesk,,https://twitter.com/cytoscape,https://nrnb.org/testimonials.html#profile-tab,"web application, data science, graphics, scientific computing, network biology","python, javascript, java, web, c++"
2019,Neovim,Programming languages,Vim-fork focused on extensibility and usability,http://neovim.io,2,https://summerofcode.withgoogle.com/archive/2019/organizations/4864359866564608/,mailto:justinkz+gsoc@gmail.com,https://groups.google.com/forum/#!forum/neovim,https://gitter.im/neovim/neovim,https://twitter.com/neovim,https://neovim.io/news/,"developer tools, cross-platform, text editor, editor, system programming","c, lua"
