year,name,category,description,url,num_projects,projects_url,contact_email,mailing_list,irc_channel,twitter_url,blog_url,topics,technologies
2023,Apache Software Foundation,Other,Open source software to the public free of charge,https://apache.org,25,https://summerofcode.withgoogle.com/programs/2023/organizations/apache-software-foundation,,http://apache.org/foundation/mailinglists.html,,https://twitter.com/theasf,,"big data, cloud, libraries, other","c, java, c++"
2023,SageMath,Science and medicine,Open-source mathematics software system,https://www.sagemath.org,6,https://summerofcode.withgoogle.com/programs/2023/organizations/sagemath,mailto:tcscrims@gmail.com,https://groups.google.com/g/sage-gsoc,https://twitter.com/sagemath,https://twitter.com/sagemath,,"mathematics, education, research","python, cython"
2023,FFmpeg,Media,"Record, convert and stream audio & video",https://ffmpeg.org/,3,https://summerofcode.withgoogle.com/programs/2023/organizations/ffmpeg,,http://ffmpeg.org/contact.html#MailingLists,http://ffmpeg.org/contact.html#IRCChannels,,,"audio, video, subtitles, multimedia","c, git, asm"
2023,MZmine and MS-DIAL,Science and medicine,Open-source software for mass spectrometry,https://mzmine-ms-dial-gsoc.github.io/,2,https://summerofcode.withgoogle.com/programs/2023/organizations/mzmine-and-ms-dial,mailto:mzmine.msdial.gsoc@gmail.com,,,https://twitter.com/msdial_project,,"data science, graphics, cheminformatics, mass spectrometry, feature detection","java, c#, javafx"
2023,R project for statistical computing,Science and medicine,R software for statistical computing & graphics,https://www.r-project.org/,9,https://summerofcode.withgoogle.com/programs/2023/organizations/r-project-for-statistical-computing,mailto:gsoc-r@googlegroups.com,gsoc-r@googlegroups.com,,,,"visualization, machine learning, data science, graphics, statistics","c, javascript, c++, r-project, fortran"
2023,RTEMS Project,Operating systems,A real-time operating system for Earth & Space,https://www.rtems.org/,3,https://summerofcode.withgoogle.com/programs/2023/organizations/rtems-project,mailto:https://devel.rtems.org/wiki/RTEMSMailingLists,,https://devel.rtems.org/wiki/Developer/discord,,,"kernel, embedded, real-time, multicore, rtos","python, c/c++, assembly, posix"
2023,MetaBrainz Foundation Inc,Data,"Open music / book metadata, music recommendations",https://metabrainz.org,7,https://summerofcode.withgoogle.com/programs/2023/organizations/metabrainz-foundation-inc,mailto:suppport@metabrainz.org,,https://metabrainz.org/contact,metabrainz,,"open data, music, books, Music recommendation, music social network","python, react, perl, postgres, spark"
2023,SymPy,Science and medicine,SymPy is a Python library for symbolic mathematics,https://www.sympy.org/,5,https://summerofcode.withgoogle.com/programs/2023/organizations/sympy,,https://groups.google.com/g/sympy,,,,"mathematics, physics, symbolic mathematics","python, numpy, jupyter"
2023,Apertium,Science and medicine,A free/open-source machine translation platform,https://apertium.org/,5,https://summerofcode.withgoogle.com/programs/2023/organizations/apertium,,apertium-stuff@lists.sourceforge.net,https://wiki.apertium.org/wiki/IRC,,,"natural language processing, machine translation, language technology, less-resources languages","python, javascript, c++, xml, bash"
2023,The Honeynet Project,Security,Honeypots and Threat Intelligence R&D,https://honeynet.org,6,https://summerofcode.withgoogle.com/programs/2023/organizations/the-honeynet-project,,,https://gsoc-slack.honeynet.org/,,https://www.honeynet.org/blog/,"honeypots, malware analysis, Threat Intelligence","python, javascript, django, go, docker"
2023,MDAnalysis,Science and medicine,Analysis of molecular simulations data with Python,https://www.mdanalysis.org,2,https://summerofcode.withgoogle.com/programs/2023/organizations/mdanalysis,,https://groups.google.com/a/mdanalysis.org/g/gsoc,,https://twitter.com/mdanalysis,https://www.mdanalysis.org/blog/,"science, computational-chemistry, high-performance-computing, molecular-simulation, soft-matter-physics","python, cython, c/c++"
2023,Open Chemistry,Science and medicine,Advancing Open Source & Open Science for Chemistry,https://openchemistry.org/,8,https://summerofcode.withgoogle.com/programs/2023/organizations/open-chemistry,,https://public.kitware.com/mailman/listinfo/openchemistry-developers,,https://twitter.com/openchem,,"data science, graphics, scientific visualization, cheminformatics, quantum chemistry","python, javascript, opengl, c++, c++14"
2023,GCP Scanner,Security,Security scanning tool for Google Cloud,https://github.com/google/gcp_scanner/wiki/Google-Summer-of-Code-2023,3,https://summerofcode.withgoogle.com/programs/2023/organizations/gcp-scanner,mailto:gcp_scanner@google.com,https://groups.google.com/g/gcp-scanner,https://mail.google.com/chat/u/0/#chat/space/AAAASZhS34E,https://twitter.com/mshudrak,,"security, automation, scanning, google cloud","python, google cloud"
2023,Learning Equality,End user applications,Equity in education to transform lives,https://learningequality.org/,3,https://summerofcode.withgoogle.com/programs/2023/organizations/learning-equality,mailto:gsoc@learningequality.org,,,,https://blog.learningequality.org/,"education, distributed databases, offline, learning","python, javascript, django, vue.js"
2023,Pitivi,End user applications,Self-expression through filmmaking,https://www.pitivi.org/,2,https://summerofcode.withgoogle.com/programs/2023/organizations/pitivi,mailto:pitivi@pitivi.org,,https://matrix.to/#/#pitivi:matrix.org,https://twitter.com/pitivi,https://www.pitivi.org/news/,"video processing, filmmaking, video editing","c, python, gtk, gstreamer"
2023,GitLab,Infrastructure and cloud,Everyone can contribute,https://gitlab.com,3,https://summerofcode.withgoogle.com/programs/2023/organizations/gitlab,mailto:contributors@gitlab.com,,https://discord.gg/gitlab,https://twitter.com/gitlab,,"cloud, devops","javascript, ruby on rails, go, ruby, vue"
2023,caMicroscope,Science and medicine,Toolkit for cancer imaging research,https://camicroscope.github.io,3,https://summerofcode.withgoogle.com/programs/2023/organizations/camicroscope,mailto:camicroscope-gsoc@googlegroups.com,https://github.com/camicroscope/GSOC/discussions,,,https://camicroscope.github.io/community,"data visualization, image analysis, AI/ML, microscopy, dicom pathology","python, javascript, mongodb, opencv, tensorflow"
2023,Micro Electronics Research Lab - UITU,Other,Accelerating Engineering Innovation,https://www.merledupk.org,1,https://summerofcode.withgoogle.com/programs/2023/organizations/micro-electronics-research-lab-uitu,,,https://gitter.im/merledu/community,https://twitter.com/merluit,,"iot, embedded, Processor, System on Chip, RISC-V","RISCV, Processor, Hardware, systemonchip, memory"
2023,OpenMRS,Programming languages,"Write Code, Save Lives.",https://openmrs.org/,9,https://summerofcode.withgoogle.com/programs/2023/organizations/openmrs,,https://talk.openmrs.org/,,https://twitter.com/openmrs,,"platform, frontend, Electronic Medical Record System, QA automation","mysql, javascript, java, reactjs, fhir"
2023,Wagtail,Web,The powerful Python CMS for modern websites,https://wagtail.org/,2,https://summerofcode.withgoogle.com/programs/2023/organizations/wagtail,,https://github.com/wagtail/gsoc/discussions,,https://twitter.com/wagtailcms,https://wagtail.org/blog/,"web, accessibility, cms","python, javascript, django"
2023,OpenWISP,End user applications,The Hackable Network Management System,https://openwisp.org,1,https://summerofcode.withgoogle.com/programs/2023/organizations/openwisp,,https://groups.google.com/forum/#!aboutgroup/openwisp,https://gitter.im/openwisp/general,https://twitter.com/openwisp,,"networking, network management system, wifi, vpn, sdn","python, javascript, django, lua, openwrt"
2023,SCoRe Lab,End user applications,SCoRe Lab develops FOSS softwares for everyone!!!,https://scorelab.org/,12,https://summerofcode.withgoogle.com/programs/2023/organizations/score-lab,mailto:gsoc@scorelab.org,https://groups.google.com/g/score-community,https://app.gitter.im/#/room/#scorelab_Google-Summer-of-Code:gitter.im,https://twitter.com/SCoReLab_Org,https://medium.com/scorelab,"security, web, machine learning, cloud","python, java, go, nodejs, reactjs"
2023,Gentoo Foundation,Operating systems,"A flexible, source-based Linux distribution.",https://www.gentoo.org/,3,https://summerofcode.withgoogle.com/programs/2023/organizations/gentoo-foundation,,gentoo-soc@lists.gentoo.org ,https://web.libera.chat/?channels=#gentoo-soc,,,"operating systems, security, embedded, init, package","c, python, shell, linux, bash"
2023,Free and Open Source Silicon Foundation,Other,Working together for Free and Open Source Silicon,https://www.fossi-foundation.org,5,https://summerofcode.withgoogle.com/programs/2023/organizations/free-and-open-source-silicon-foundation,mailto:gsoc@fossi-foundation.org,,https://gitter.im/librecores/Lobby,https://twitter.com/fossifoundation,,"hardware, debug, web services, simulation, electronic design tools","verilog, risc-v, compiler, web development"
2023,Oppia Foundation,End user applications,"Free platform for interactive, tutor-like lessons",https://www.oppia.org,5,https://summerofcode.withgoogle.com/programs/2023/organizations/oppia-foundation,,https://github.com/oppia/oppia/discussions,,https://twitter.com/oppiaorg?lang=en,https://medium.com/oppia-org,"education, web, community, nonprofit, social impact","python, google app engine, angular, typescript"
2023,AOSSIE,End user applications,Australian Umbrella Org for Open-Source Projects,https://aossie.gitlab.io/,6,https://summerofcode.withgoogle.com/programs/2023/organizations/aossie,,,https://discord.gg/xbPtJ9Jd,https://twitter.com/aossie_org,,"machine learning, electronic voting, natural language processing, social science","python, javascript, machine learning, scala, Blockchain"
2023,The Palisadoes Foundation,End user applications,Transforming non-profit organizations in the cloud,https://www.palisadoes.org,8,https://summerofcode.withgoogle.com/programs/2023/organizations/the-palisadoes-foundation,,https://www.freelists.org/list/palisadoes,https://www.palisadoes.org/slack,,https://www.palisadoes.org/news/,"web, api, database, cloud, mobile","mongodb, flutter, graphql, typescript"
2023,XMPP Standards Foundation,End user applications,XSF develops an open-standard messaging protocol,https://xmpp.org/,2,https://summerofcode.withgoogle.com/programs/2023/organizations/xmpp-standards-foundation,mailto:xsfcommteam@protonmail.com,https://mail.jabber.org/mailman/listinfo/gsoc,https://xmpp.org/chat#converse/room?jid=gsoc@muc.xmpp.org,https://fosstodon.org/@xmpp,https://xmpp.org/blog/,"instant messaging, chat, WebRTC, Jingle, Real-Time Communication","vala, xmpp, swift, dart, Objective C"
2023,The FreeBSD Project,Operating systems,FreeBSD: An OS for servers to embedded systems,https://www.freebsd.org/,6,https://summerofcode.withgoogle.com/programs/2023/organizations/the-freebsd-project,mailto:soc-admins@FreeBSD.org,https://lists.freebsd.org/mailman/listinfo/freebsd-hackers,https://wiki.freebsd.org/SummerOfCode/IRC,https://twitter.com/freebsdfndation,,"virtualization, operating system, Embedded System","c, llvm, assembly, make, POSIX shell"
2023,MuseScore,End user applications,The Worlds Most Popular Music Notation Software,https://musescore.org/,1,https://summerofcode.withgoogle.com/programs/2023/organizations/musescore,,,https://musescore.org/en/node/271551,,https://musescore.org/en/node/271551,"music, midi, musicxml, sheet music, music notation","c++, qt, qml, cmake"
2023,52North Spatial Information Research GmbH,Science and medicine,Innovative ideas & technologies in geoinformatics,https://52north.org/,3,https://summerofcode.withgoogle.com/programs/2023/organizations/52north-spatial-information-research-gmbh,mailto:gsoc@52north.org,gsoc-52n@52north.org,https://52n-gsoc.slack.com/ssb/redirect,,,"citizen science, spatial information infrastructures, open standards, data analytics, Geoinformation","javascript, android, java, web services, ogc standards"
2023,checkstyle,Programming languages,Helps to adheres of Java coding standard,https://checkstyle.org,2,https://summerofcode.withgoogle.com/programs/2023/organizations/checkstyle,,https://groups.google.com/g/checkstyle-devel,https://gitter.im/checkstyle/checkstyle,,https://groups.google.com/g/checkstyle-devel,"static code analysis, code review tool, coding standards, coding conventions","java, antlr"
2023,LLVM Compiler Infrastructure,Programming languages,LLVM Compiler Infrastructure,http://www.llvm.org,20,https://summerofcode.withgoogle.com/programs/2023/organizations/llvm-compiler-infrastructure,,https://discourse.llvm.org/c/community/gsoc/32,https://discord.com/channels/636084430946959380/642374147640524831,https://twitter.com/llvmorg,https://blog.llvm.org/,"compilers, development tools, libraries","llvm, c++, clang, mlir"
2023,Jenkins,Programming languages,"Jenkins, build great things at any scale",https://jenkins.io/,4,https://summerofcode.withgoogle.com/programs/2023/organizations/jenkins-wp,,https://community.jenkins.io/c/contributing/gsoc/6,https://gitter.im/jenkinsci/gsoc-sig,https://twitter.com/jenkinsci,https://www.jenkins.io/node/,"developer tools, automation, continuous integration, continuous delivery, devops","javascript, java, go, docker, kubernetes"
2023,Ruby,Programming languages,Ruby is an object-oriented programming language,https://www.ruby-lang.org/,4,https://summerofcode.withgoogle.com/programs/2023/organizations/ruby,mailto:saroj@zoras.me,,https://bundler.slack.com,,https://rubygsoc.github.io/,"security, web, cloud, server, application","c, java, ruby on rails, ruby, rubygems"
2023,Mayor's Office of New Urban Mechanics,Data,Exploring new approaches to civic life.,https://www.boston.gov/mechanics,4,https://summerofcode.withgoogle.com/programs/2023/organizations/mayors-office-of-new-urban-mechanics,mailto:info@newurbanmechanics.org,,,https://twitter.com/newurbanmechs,,"web, machine learning, gis, civic tech, analytics","python, javascript, ruby, tensorflow"
2023,"Department of Biomedical Informatics, Emory University",Science and medicine,Biomedical research to advance healthcare,https://med.emory.edu/departments/biomedical-informatics/,5,https://summerofcode.withgoogle.com/programs/2023/organizations/department-of-biomedical-informatics-emory-university,,,http://bit.ly/emory-bmi,https://twitter.com/emorybmi,,"science and medicine, data integration, workflows, radiology, distributed system","python, javascript, java, workflows, dicom"
