year,name,category,description,url,num_projects,projects_url,contact_email,mailing_list,irc_channel,twitter_url,blog_url,topics,technologies
2019,52°North Initiative for Geospatial Open Source Software GmbH,Science and medicine,52°North works on innovative ideas and technologies in geoinformatics,https://52north.org/,2,https://summerofcode.withgoogle.com/archive/2019/organizations/6331236958601216/,mailto:gsoc@52north.org,https://wiki.52north.org/Projects/GSoC#Contact,https://wiki.52north.org/Projects/GSoC#Contact,https://twitter.com/fivetwon?lang=en,https://blog.52north.org/,"earth observation, floating car data, ogc, web processing, sensorweb","javascript, android, java, web"
2019,AboutCode.org,Other,Find the origin and license of code,https://aboutcode.org,3,https://summerofcode.withgoogle.com/archive/2019/organizations/5430785606156288/,,,https://gitter.im/aboutcode-org/discuss,,,"package managers, license-scan, oss licensing, copyright, license compliance","python, javascript, nlp, automaton, search"
2019,AerospaceResearch.net,Science and medicine,making space together,http://www.aerospaceresearch.net,7,https://summerofcode.withgoogle.com/archive/2019/organizations/5335970445000704/,mailto:gsoc2019@aerospaceresearch.net,https://lists.shackspace.de/mailman/listinfo/constellation,https://aerospaceresearch.zulipchat.com/,https://twitter.com/ARDNnews,http://aerospaceresearch.net,"distributed computing, space applications, software defined radio, cubesats, simulations","python, c/c++, java, vhdl, boinc"
2019,aimacode,Programming languages,"Code for the book ""Artificial Intelligence: A Modern Approach""",https://github.com/aimacode,4,https://summerofcode.withgoogle.com/archive/2019/organizations/5844178540429312/,mailto:peter.norvig+gsoc@gmail.com,http://aima.cs.berkeley.edu/gsoc.html,http://aima.cs.berkeley.edu/gsoc.html,,,"education, machine learning, artificial intelligence, open education","python, javascript, java, machine learning, python 3"
2019,Amahi,End user applications,Making Home Networking and Storage Simple,https://www.amahi.org,7,https://summerofcode.withgoogle.com/archive/2019/organizations/6556685512998912/,mailto:gsoc@amahi.org,,https://www.amahi.org/community,https://twitter.com/amahi,https://blog.amahi.org,"web apps, media server, storage server, streaming, backups","android, ruby on rails, golang, ios, containers"
2019,Android Graphics Tools Team,Programming languages,Providing excellent tools for graphics developers and driver makers,https://github.com/google/graphicsfuzz,2,https://summerofcode.withgoogle.com/archive/2019/organizations/5704209515675648/,mailto:android-graphics-tools@google.com,,,,,"testing, bug finding, developer tools, debugging, 2d/3d graphics","c/c++, java, opengl, vulkan, spir-v"
2019,AOSSIE - Australian Open Source Software Innovation and Education,End user applications,Australian Umbrella Org for Open-Source Projects,http://aossie.org/,18,https://summerofcode.withgoogle.com/archive/2019/organizations/4551437139312640/,,,https://gitter.im/AOSSIE/Lobby,https://twitter.com/aossie_org,,"machine learning, environment, electronic voting, natural language processing, philosophy","javascript, android, scala, ios, isabelle proof assistant"
2019,Apertium,Other,A free/open-source machine translation platform,http://wiki.apertium.org,10,https://summerofcode.withgoogle.com/archive/2019/organizations/5281228587008000/,mailto:apertium-contact@lists.sourceforge.net,https://sourceforge.net/projects/apertium/lists/apertium-stuff,http://wiki.apertium.org/wiki/IRC,,,"natural language processing, machine translation, less-resourced languages","python, c++, xml, bash"
2019,apertus° Association,Media,open technology for professional film production,http://www.apertus.org,4,https://summerofcode.withgoogle.com/archive/2019/organizations/5576921247645696/,mailto:team@apertus.org,https://www.apertus.org/mailinglists,https://www.apertus.org/irc-chat,https://twitter.com/ApertusOSCinema,,"embedded systems, vision, camera, image processing, fpga","c, linux, fpga, vhdl, embedded"
2019,API Client Tools at Google,Programming languages,Industry-leading user experiences for networked APIs.,https://googleapis.github.io,1,https://summerofcode.withgoogle.com/archive/2019/organizations/6340359469137920/,mailto:actools-info@google.com,,,https://twitter.com/googleapis,,"automation, apis, code generation, api description","rest, openapi, grpc, protocol buffers, rpc"
2019,appleseedhq,Media,A modern open source rendering engine for animation and visual effects,https://appleseedhq.net/,2,https://summerofcode.withgoogle.com/archive/2019/organizations/5485316792647680/,mailto:contact@appleseedhq.net,,https://discord.gg/dNCE5J8,https://twitter.com/appleseedhq,,"simulation, rendering, computer graphics, image synthesis, animation","python, opengl, c++11"
2019,Ardupilot.org,Other,The worlds most advanced open source autopilot,http://ardupilot.org,5,https://summerofcode.withgoogle.com/archive/2019/organizations/6052415684476928/,mailto:ardupilot.devel@gmail.com,https://discuss.ardupilot.org/c/google-summer-of-code,https://gitter.im/ArduPilot/GSoC,https://twitter.com/ArduPilotTeam,https://discuss.ardupilot.org/c/blog,"robotics, embedded systems, real-time os, drones, vison","python, linux, c/c++, drones, robotics"
2019,Bazel,Programming languages,"Build and test software of any size, quickly and reliably",https://bazel.build/,2,https://summerofcode.withgoogle.com/archive/2019/organizations/5906507105828864/,mailto:bazel-dev@googlegroups.com,,,https://twitter.com/bazelbuild,https://blog.bazel.build/,"build tools, developer tools","c/c++, java, windows, bazel"
2019,BeagleBoard.org,Other,Open hardware computing from kindergarten to kickstarter,https://beagleboard.org,3,https://summerofcode.withgoogle.com/archive/2019/organizations/6713523407683584/,mailto:gsoc@beagleboard.org,https://beagleboard.org/gsocml,https://beagleboard.org/gsocchat,https://twitter.com/beagleboardorg,https://beagleboard.org/blog,"machine learning, robotics, hardware, real time, privacy/security","python, javascript, linux kernel, raspberry pi, hardware acceleration"
2019,Berkman Klein Center for Internet and Society,Other,"Exploring cyberspace, sharing in its study, & helping to pioneer its development",https://cyber.harvard.edu,3,https://summerofcode.withgoogle.com/archive/2019/organizations/5781930639884288/,mailto:gsoc@cyber.harvard.edu,https://cyber.harvard.edu/getinvolved,https://cyber.harvard.edu/gsoc/Main_Page#Contact_Us,https://twitter.com/BKCHarvard,https://blogs.harvard.edu/geeks/,"education, research, web, internet freedom, internet censorship","python, java, ruby on rails, elasticsearch, meteor.js"
2019,"Biomedical Informatics, Emory University",Science and medicine,"Department of Biomedical Informatics (BMI), Emory University School of Medicine",https://github.com/sharmalab/Emory-BMI-GSoC-2019,4,https://summerofcode.withgoogle.com/archive/2019/organizations/4661625682919424/,mailto:pradeeban.kathiravelu@emory.edu,https://gsoc2019-bmi.slack.com,https://github.com/sharmalab/Emory-BMI-GSoC-2019#communicating-with-the-mentors,https://twitter.com/emorybmi,,"cloud, distributed systems, science and medicine, precision medicine, data integration","python, java, tensorflow, deep learning, medical imaging"
2019,Blender Foundation,Media,"Free and open source 3D creation for everyone, forever.",http://www.blender.org,7,https://summerofcode.withgoogle.com/archive/2019/organizations/4524507157495808/,mailto:foundation@blender.org,http://projects.blender.org/mailman/listinfo/bf-committers,https://www.blender.org/get-involved/developers/,https://twitter.com/@blender_org,https://code.blender.org,"3d, rendering, animation, vfx, modeling","c, python, opengl, c++"
2019,Boost C++,Programming languages,Boost provides free peer-reviewed portable C++ source libraries,https://www.boost.org/,11,https://summerofcode.withgoogle.com/archive/2019/organizations/5525710674853888/,mailto:david.bellot@gmail.com,https://www.boost.org/community/groups.html,https://www.boost.org/community/irc.html,https://twitter.com/boost_libraries?lang=en,,c++ libraries c++ standard,c++ libraries c++11 c++14 c++17 c++20
2019,BRL-CAD,Media,"Solid geometry, computer graphics, 3D printing, modeling, CAD, CAM, & other CAx!",https://opencax.github.io,8,https://summerofcode.withgoogle.com/archive/2019/organizations/6089800153563136/,mailto:devs@brlcad.org,http://brlcad.org/wiki/Mailing_Lists,https://brlcad.zulipchat.com,https://twitter.com/BRL_CAD,http://fb.me/brlcad,"performance, 2d/3d graphics, ray tracing, solid geometry, cad/cam/cae","python, javascript, c/c++, opengl, opencl"
2019,Buildroot,Programming languages,Making Embedded Linux easy,http://www.buildroot.org,1,https://summerofcode.withgoogle.com/archive/2019/organizations/5526850200141824/,mailto:buildroot-association@buildroot.org,http://lists.buildroot.org/mailman/listinfo/buildroot,https://buildroot.org/support.html,https://twitter.com/buildrootorg,,"build tools, embedded systems, linux, compilation","python, shell, gnu make, kconfig"
2019,Canadian Center for Computational Genomics,Science and medicine,Analytical solutions for Next-Generation Sequencing data,http://computationalgenomics.ca/,4,https://summerofcode.withgoogle.com/archive/2019/organizations/5152322794029056/,mailto:gsoc2019@computationalgenomics.ca,,,https://twitter.com/C3Genomics,,"visualization, web, bioinformatics, science, statistics","python, javascript, react, nodejs, r-project"
2019,Catrobat,Programming languages,Computational Thinking for All with Free Visual Coding Apps,https://catrobat.org,9,https://summerofcode.withgoogle.com/archive/2019/organizations/6726416631070720/,mailto:contact@catrobat.org,https://catrob.at/mailinglist,,,,"web, app development, visual programming, gaming","android, java, swift, symfony"
2019,cBioPortal for Cancer Genomics,Data,Developing open source solutions for discovery from complex cancer data,http://www.cbioportal.org/,6,https://summerofcode.withgoogle.com/archive/2019/organizations/6278222700871680/,,,https://slack.cbioportal.org/,https://twitter.com/cbioportal,,"genomics, data visualization, bioinformatics, big data, cancer research","javascript, java, reactjs, database, web apps"
2019,CBMI@UTHSC,Science and medicine,We develop Biomedical and Clinical informatics applications,https://cbmi.lab.uthsc.edu/people-2/people/,3,https://summerofcode.withgoogle.com/archive/2019/organizations/6344880593305600/,mailto:cbmiuthsc@gmail.com,https://groups.google.com/forum/#!forum/cbmiuthsc-gsoc/new,,https://twitter.com/cbmi_uthsc,,"machine learning, deep learning, web applications, sepsis prediction, sepsis detection","python, javascript, flask, tensorflow, reactjs"
2019,CCExtractor Development,Media,"Tools to make the world more accessible, starting with media",https://www.ccextractor.org/,10,https://summerofcode.withgoogle.com/archive/2019/organizations/6733668347805696/,mailto:gsoc@ccextractor.org,https://groups.google.com/forum/#!forum/ccextractor-dev,https://www.ccextractor.org/public:general:support,,,"ai, vision, subtitles, accessibility, tv","c, python, javascript, cloud, ai"
2019,Center for Research in Open Source Software at UC Santa Cruz,Other,Bridging Gap Between Student Work and Successful Open Souce Projects,http://cross.ucsc.edu,4,https://summerofcode.withgoogle.com/archive/2019/organizations/5907529257713664/,mailto:cross-info@ucsc.edu,https://cross.ucsc.edu/contact/index.html,https://gitter.im/uccross/gsoc,https://twitter.com/@cross_ucsc,https://cross.ucsc.edu/news/index.html,"cloud databases, reproducibility, ceph, architecture, generative text","python, javascript, c/c++, verilog"
2019,CERN-HSF,Science and medicine,Umbrella organization for Particle (High-Energy) Physics-related projects,http://hepsoftwarefoundation.org/activities/gsoc.html,29,https://summerofcode.withgoogle.com/archive/2019/organizations/4534645092253696/,mailto:hep-software-foundation-google-summer-of-code@googlegroups.com,http://hepsoftwarefoundation.org/activities/gsoc.html,,,,"machine learning, big data, physics, particle physics, high-energy physics","python, c/c++, machine learning, data analysis, parallelization"
2019,CGAL project,Science and medicine,C++ library of computational geometry and geometry processing,https://www.cgal.org,9,https://summerofcode.withgoogle.com/archive/2019/organizations/4870847817318400/,mailto:gsoc-cgal@inria.fr,https://www.cgal.org/mailing_list.html,,,,"computational geometry, mesh processing, arrangement, geometry processing, point set processing","python, c++, git, swig"
2019,CHAOSS,Social and communication,Aimed at improving our understanding of open source health and sustainability,https://chaoss.community,4,https://summerofcode.withgoogle.com/archive/2019/organizations/6603033897598976/,,https://chaoss.community/participate/,,https://twitter.com/chaossproj,https://chaoss.community/community/,"metrics, health, community, sustainability","python, mysql, javascript, jupyter, elasicsearch"
2019,Chapel,Programming languages,a Productive Parallel Programming Language,https://chapel-lang.org/,4,https://summerofcode.withgoogle.com/archive/2019/organizations/5677337046155264/,mailto:chapel-gsoc@cray.com,https://chapel-lang.org/users.html,https://gitter.im/chapel-lang/chapel,https://twitter.com/ChapelLanguage,,"compilers, programming languages, distributed computing, high performance computing, parallel computing","c, python, c++, chapel, high performance computing"
2019,Checker Framework,Programming languages,"Prevent programming errors before they happen, via easy-to-use verification",https://checkerframework.org/,5,https://summerofcode.withgoogle.com/archive/2019/organizations/4937505709752320/,,https://groups.google.com/forum/#!forum/checker-framework-gsoc,,,,"pragrammer productivity, software engineering, verification, bug finding, programming languages",java
2019,CircuitVerse.org,Web,Have fun exploring logic circuits right from your browser!,https://circuitverse.org/,3,https://summerofcode.withgoogle.com/archive/2019/organizations/6563824134520832/,mailto:support@circuitverse.org,https://circuitverse.us20.list-manage.com/subscribe?u=89207abda49deef3ba56f1411&id=29473194d6,https://gitter.im/CircuitVerse/community?utm_source=share-link&utm_medium=link&utm_campaign=share-link,,,"education, web, simulations, pedagogy, digital logic design","postgresql, javascript, bootstrap, rails, html5 canvas"
2019,CiviCRM,Data,Growing and sustaining relationships,https://civicrm.org,2,https://summerofcode.withgoogle.com/archive/2019/organizations/4799145083142144/,mailto:info@civicrm.org,,https://chat.civicrm.org,,https://civicrm.org/blog,crm,"mysql, javascript, php, angularjs"
2019,"CLiPS, University of Antwerp",Data,Computational Psycholinguistics,https://www.uantwerpen.be/en/research-groups/clips,4,https://summerofcode.withgoogle.com/archive/2019/organizations/5344579304292352/,mailto:clips.gsoc@gmail.com,,http://www.clips.uantwerpen.be:3001/,https://twitter.com/clipsua,https://newsaudit.net,"text analytics, machine learning, artificial intelligence, natural language processing, text generation","python, javascript, mongodb"
2019,Cloud Native Computing Foundation (CNCF),Infrastructure and cloud,Sustaining and Integrating Cloud Native Open Source Technologies,https://www.cncf.io,15,https://summerofcode.withgoogle.com/archive/2019/organizations/6034778267058176/,mailto:soc@cncf.io,,https://github.com/cncf/soc,https://twitter.com/cloudnativefdn,https://www.cncf.io/newsroom/blog/,"cloud, containers","prometheus, golang, docker, kubernetes"
2019,CloudCV,Infrastructure and cloud,Building platforms for reproducible AI research,https://cloudcv.org,4,https://summerofcode.withgoogle.com/archive/2019/organizations/4813273243844608/,mailto:team@cloudcv.org,https://groups.google.com/forum/#!forum/cloudcv,https://gitter.im/Cloud-CV/,https://twitter.com/project_cloudcv,,"machine learning, artificial intelligence, computer vision, deep-learning","django, python 3, docker, angularjs, aws"
2019,coala,Programming languages,Linting and Fixing Code for All Languages,https://coala.io,10,https://summerofcode.withgoogle.com/archive/2019/organizations/5097595045675008/,,https://github.com/coala/coala/wiki/Mailing-Lists,http://coala.io/chat,http://twitter.com/coala_io,https://blog.coala.io/,"devops, code analysis, chatops","java, haskell, python 3, docker, angularjs"
2019,Computational Biology @ University of Nebraska-Lincoln,Science and medicine,"Tool development in bioinformatics, computational biology, data visualization",http://helikarlab.org,5,https://summerofcode.withgoogle.com/archive/2019/organizations/6093511005306880/,mailto:helikarlab@gmail.com,https://groups.google.com/forum/#!forum/helikarlab-gsoc,,,,"bioinformatics, web application, data science, computational biology, network biology","postgresql, javascript, react, webgl"
2019,coreboot,Operating systems,open source firmware projects,https://www.coreboot.org/,3,https://summerofcode.withgoogle.com/archive/2019/organizations/6048278473342976/,mailto:coreboot@coreboot.org,https://doc.coreboot.org/community/forums.html,https://doc.coreboot.org/community/forums.html,https://twitter.com/coreboot_org,https://blogs.coreboot.org/,"hardware, firmware","c, assembler"
2019,Creative Commons,Other,"Nonprofit building tools to promote digital creativity, sharing, and innovation.",https://creativecommons.org,5,https://summerofcode.withgoogle.com/archive/2019/organizations/5500455663173632/,,https://creativecommons.github.io/community/,https://creativecommons.github.io/community/,https://twitter.com/creativecommons,https://creativecommons.org/blog/,"web, nonprofit, copyleft, creative commons, legal","python, postgresql, javascript, elasticsearch, wordpress"
2019,CRIU (Checkpoint/Restore in User-space),Operating systems,CRIU (Checkpoint/Restore in User-space),https://criu.org,1,https://summerofcode.withgoogle.com/archive/2019/organizations/6267159469096960/,mailto:criu@openvz.org,https://lists.openvz.org/mailman/listinfo/criu,,https://twitter.com/__criu__,,"cloud, save/restore, load-balancing, zero-downtime, migration","linux, docker, containers, kernel"
2019,Cuneiform Digital Library Initiative (CDLI),Data,International digital library of artifacts inscribed with cuneiform writing,https://cdli.ucla.edu,5,https://summerofcode.withgoogle.com/archive/2019/organizations/4653253634031616/,mailto:cdli@ucla.edu,,,https://twitter.com/cdli_news,,"computer vision, data processing pipeline, nlp, lod, data-collection","python, mysql, java, php, html/css"
2019,D Programming Language,Programming languages,"Fast code, fast.",https://dlang.org,5,https://summerofcode.withgoogle.com/archive/2019/organizations/6223494952517632/,mailto:gsoc@dlang.rocks,https://forum.dlang.org,https://kiwiirc.com/nextclient/#irc://irc.freenode.net/#d,https://twitter.com/D_Programming,https://dlang.org/blog,"programming languages, functional programming, web programming, object-oriented programming, system programming","linux, osx, windows, bsd, dlang"
2019,DBpedia,Data,Global and Unified Access to Knowledge.,http://dbpedia.org,6,https://summerofcode.withgoogle.com/archive/2019/organizations/5142599592050688/,mailto:dbpedia@infai.org,https://wiki.dbpedia.org/join/get-in-touch,https://wiki.dbpedia.org/join/get-in-touch,https://twitter.com/dbpedia,http://blog.dbpedia.org/,"semantic web, linked data, ontologies, wikipedia, knowledge graph","python, javascript, java, apache spark, skala"
2019,Debian,Operating systems,The Universal Operating System,https://www.debian.org/,5,https://summerofcode.withgoogle.com/archive/2019/organizations/4816120068964352/,mailto:debian-outreach@lists.debian.org,https://www.debian.org/MailingLists/,https://wiki.debian.org/IRC,https://twitter.com/debian,https://planet.debian.org/,"operating system, packaging","python, javascript, c/c++, git, irc"
2019,Developers Italia,Other,An open community of digital public services developers,https://developers.italia.it/,3,https://summerofcode.withgoogle.com/archive/2019/organizations/5926253033422848/,mailto:teamdigitale@governo.it,,https://slack.developers.italia.it/,https://twitter.com/ITdigitalteam,https://medium.com/team-per-la-trasformazione-digitale/english/home,"open data, web applications, open source, open government, public code","python, go, node.js, scala, html/css/js"
2019,Digital Impact Alliance,Other,Supporting open source projects for a digital society that serves everyone.,http://digitalimpactalliance.org/,3,https://summerofcode.withgoogle.com/archive/2019/organizations/6180395375132672/,mailto:osc@dial.community,https://forum.osc.dial.community,https://dial.zulipchat.com/#narrow/stream/110501-OSC-Summer.20of.20Codel,https://twitter.com/DIAL_Community,https://digitalimpactalliance.org/blog/,"humanitarian, international, social good, end user application, charity","python, javascript, android, java, php"
2019,Django Software Foundation,Web,The web framework for perfectionists with deadlines.,https://www.djangoproject.com/,2,https://summerofcode.withgoogle.com/archive/2019/organizations/5608632467587072/,,https://groups.google.com/forum/#!topic/django-developers/,https://docs.djangoproject.com/en/dev/internals/contributing/new-contributors/,https://twitter.com/djangoproject/,https://www.djangoproject.com/weblog/,web development,"python, django"
2019,Drupal,Web,"Drupal is a Free, Open, Modular CMS written in PHP. Let's make something amazing",https://www.drupal.org,2,https://summerofcode.withgoogle.com/archive/2019/organizations/4872193886912512/,mailto:lechleider.matthew@gmail.com,https://groups.drupal.org/google-summer-code,https://drupal.slack.com/messages/C2ESCQHNX,https://twitter.com/drupal,https://www.drupal.org/planet,"web application, web development, content management, backend, martech","javascript, sql, php, symfony, drupal 8"
2019,Earth Science Information Partners,Science and medicine,Supporting community development of visionary Earth science data technology.,http://esipfed.org,2,https://summerofcode.withgoogle.com/archive/2019/organizations/6268499498893312/,mailto:lab@esipfed.org,,https://esip-slack-invite.herokuapp.com/,https://twitter.com/esipfed,,"semantic web, data visualisation, earth observation, cloud databases, data-science","python, kubernetes, deep learning, jupyter, gdal"
2019,Fedora Project,Operating systems,"Fedora Linux is built on the foundations of Freedom, Friends, Features, & First",https://getfedora.org/,5,https://summerofcode.withgoogle.com/archive/2019/organizations/6739854375780352/,mailto:summer-coding@lists.fedoraproject.org,https://lists.fedoraproject.org/admin/lists/summer-coding@lists.fedoraproject.org,https://webchat.freenode.net/?channels=#fedora-summer-coding,https://twitter.com/fedora,https://communityblog.fedoraproject.org,"web development, linux, containers, mobile, distribution","python, golang, rest, angular, html/css/js"
2019,FFmpeg,Media,"A complete, cross-platform solution to record, convert and stream multimedia.",https://ffmpeg.org/,6,https://summerofcode.withgoogle.com/archive/2019/organizations/6415948024643584/,mailto:thilo.borgmann@googlemail.com,https://ffmpeg.org/contact.html#MailingLists,https://ffmpeg.org/contact.html#IRCChannels,,,"audio, image processing, video, multimedia","assembler, c99"
2019,FOSDEM,Programming languages,The organization that handles all aspects of the FOSDEM conference,https://fosdem.org,2,https://summerofcode.withgoogle.com/archive/2019/organizations/5379070022385664/,mailto:info@fosdem.org,,http://webchat.freenode.net/?channels=fosdem-gsoc,https://twitter.com/fosdem,,"web development, conference, rails application, video processing","javascript, ruby on rails, grafana, voctomix, influxdb"
2019,FOSSASIA,Other,Improving People's live with Open Tech,https://fossasia.org,14,https://summerofcode.withgoogle.com/archive/2019/organizations/5483378286002176/,mailto:fossasia@googlegroups.com,https://groups.google.com/d/forum/fossasia,https://gitter.im/fossasia/fossasia,https://twitter.com/fossasia,https://blog.fossasia.org,"artificial intelligence, open science, search, event management, voice assistants","c, python, javascript, java, reactjs"
2019,FOSSology Project,Other,FOSSology is an open source license compliance software system and toolkit.,https://www.fossology.org/,3,https://summerofcode.withgoogle.com/archive/2019/organizations/4832912116023296/,mailto:fossology@fossology.org,https://lists.fossology.org/g/fossology-devel,https://fossology.slack.com,,,"compliance, spdx, license-scan, oss licensing, oss compliance","postgresql, c/c++, php, jquery, bash"
2019,FrameNet Brasil at the Federal University of Juiz de Fora,Data,Natural Language Understanding with structured computational semantics,http://www.ufjf.br/framenetbr-eng/,2,https://summerofcode.withgoogle.com/archive/2019/organizations/5090343328940032/,mailto:projeto.framenetbr@ufjf.edu.br,,https://framenetbrgsoc.slack.com,,,"natural language processing, image processing, multimodality, natural language understanding, machine translation","python, mysql, javascript, php"
2019,Free and Open Source Silicon Foundation,Other,Working together to improve the Free and Open Source Silicon ecosystem,https://www.fossi-foundation.org,7,https://summerofcode.withgoogle.com/archive/2019/organizations/5087457110917120/,mailto:gsoc@fossi-foundation.org,https://lists.librecores.org/listinfo/discussion,https://gitter.im/librecores/Lobby,https://twitter.com/fossifoundation,https://fossi-foundation.org/archive,"hardware, debug, web services, simulation, electronic design tools","verilog, risc-v, compiler, web development, jenkins"
