year,name,category,description,url,num_projects,projects_url,contact_email,mailing_list,irc_channel,twitter_url,blog_url,topics,technologies
2019,Netfilter project,Operating systems,"Firewalling, NAT and packet mangling for Linux",https://www.netfilter.org,3,https://summerofcode.withgoogle.com/archive/2019/organizations/6409236987248640/,,https://netfilter.org/mailinglists.html,,https://twitter.com/nftables/,,"software defined networking, network monitoring, network security","c, linux kernel"
2019,NumFOCUS,Science and medicine,"Promoting open practices in research, data, and scientific computing.",http://numfocus.org/,19,https://summerofcode.withgoogle.com/archive/2019/organizations/5617300198129664/,mailto:gsoc@numfocus.org,https://groups.google.com/a/numfocus.org/forum/#!forum/gsoc,,https://twitter.com/numfocus,http://www.numfocus.org/blog,"data science, graphics, scientific computing, numerical computation, pydata","python, javascript, c/c++, r"
2019,NV Access,Other,Empowering lives through non-visual access to technology,https://www.nvaccess.org/,1,https://summerofcode.withgoogle.com/archive/2019/organizations/5392062852104192/,mailto:info@nvaccess.org,https://sourceforge.net/p/nvda/lists/nvda-devel/,,https://twitter.com/nvAccess,https://www.nvaccess.org/category/in-process/,"accessibility, blindness, screen reader, braille, text to speech","python, c++, ui automation, iaccessible2, win32 api"
2019,Open Astronomy,Science and medicine,Opening the eyes of research astronomy software to the whole world.,http://www.OpenAstronomy.org,9,https://summerofcode.withgoogle.com/archive/2019/organizations/5152196847468544/,mailto:openastronomy.organization@gmail.com,http://openastronomy.org,http://openastronomy.org,https://twitter.com/Open_Astronomy,http://openastronomy.org/Universe_OA/,"astronomy, visualisation, solar physics, high energy astrophysics, orbital mechanics","python, c++, julia, numba"
2019,Open Bioinformatics Foundation,Science and medicine,Promoting practice & philosophy of OSS & Open Science in biological research.,https://www.open-bio.org/,5,https://summerofcode.withgoogle.com/archive/2019/organizations/5294944380518400/,mailto:gsoc@mailman.open-bio.org,https://obf.github.io/GSoC/contact/,https://obf.github.io/GSoC/contact/,https://twitter.com/obf_news,https://news.open-bio.org/,"bioinformatics, computational biology","python, javascript, java, perl, biojs"
2019,Open Chemistry,Science and medicine,Advancing Open Source and Open Science for Chemistry,https://openchemistry.org/,6,https://summerofcode.withgoogle.com/archive/2019/organizations/4508112394911744/,,https://openchemistry.org/mailing-lists/,https://openchemistry.slack.com/,https://twitter.com/openchem,https://blog.kitware.com/tag/open-chemistry/,"data science, chemistry, graphics, scientific visualization","python, javascript, opengl, c++, html"
2019,Open Data Kit,End user applications,Open Data Kit is used to collect data for social good in difficult environments.,https://opendatakit.org,2,https://summerofcode.withgoogle.com/archive/2019/organizations/5559834475233280/,mailto:opendatakit.org@gmail.com,https://forum.opendatakit.org,http://slack.opendatakit.org,https://twitter.com/opendatakit,,"global health, mobile, global development, social good","android, java"
2019,Open Roberta,Programming languages,Open Roberta® Lab is an online IDE introducing kids to program robots with NEPO®,https://lab.open-roberta.org/,3,https://summerofcode.withgoogle.com/archive/2019/organizations/6273661445603328/,mailto:roberta-zentrale@iais.fraunhofer.de,,https://github.com/OpenRoberta/robertalab/wiki/Community,,,"education, web, robotics, visual programming","javascript, java"
2019,Open Source Robotics Foundation,Programming languages,"Open source software for use in robotics research, education and industry",https://www.openrobotics.org/,7,https://summerofcode.withgoogle.com/archive/2019/organizations/5150988804030464/,mailto:gsoc@osrfoundation.org,http://www.ros.org/contribute/,http://wiki.ros.org/Get%20Involved,https://twitter.com/openroboticsorg,https://www.openrobotics.org/blog/,robotics,"python, ros, gazebo, c++"
2019,Open Technologies Aliance - GFOSS,Programming languages,Promote Openness through use and development of Open Standards and Open Source,http://www.gfoss.eu,13,https://summerofcode.withgoogle.com/archive/2019/organizations/6491213031538688/,mailto:info@eellak.gr,https://lists.ellak.gr/gsoc-developers/listinfo.html,,https://twitter.com/gfoss_en,http://www.gfoss.eu,"programming languages, robotics, java, open education, c- c+","python, javascript, gtk, qt, arduino"
2019,OpenCV,Media,Open Source Computer Vision and Deep Learning Library,https://opencv.org,8,https://summerofcode.withgoogle.com/archive/2019/organizations/5070964117733376/,mailto:garybradski@osvf.org,https://github.com/opencv/opencv/wiki/GSoC_2019#general-information,https://github.com/opencv/opencv/wiki/GSoC_2019#general-information,https://twitter.com/opencvlibrary,https://opencv.org,"machine learning, robotics, vision, deep learning","python, c++"
2019,OpenMRS,Science and medicine,Write code. Save lives.,https://openmrs.org/,12,https://summerofcode.withgoogle.com/archive/2019/organizations/6088660628275200/,mailto:community@openmrs.org,https://talk.openmrs.org/,https://wiki.openmrs.org/display/IRC/Home,https://twitter.com/openmrs,https://blog.openmrs.org,"science and medicine, open source, medical record, developing countries","mysql, javascript, android, java, spring"
2019,OpenStreetMap,Data,Creating and distributing free geographic data for the world.,https://www.openstreetmap.org/,5,https://summerofcode.withgoogle.com/archive/2019/organizations/4651509608873984/,,https://lists.openstreetmap.org/listinfo/talk,https://wiki.openstreetmap.org/wiki/IRC,https://twitter.com/openstreetmap,https://blog.openstreetmap.org/,"open data, geoinformatics, gis, maps, crowdsourcing","javascript, c/c++, java, ruby"
2019,OpenWISP,End user applications,A Hackable Network Management System for the 21st Century,http://openwisp.org,2,https://summerofcode.withgoogle.com/archive/2019/organizations/4578309608833024/,,https://groups.google.com/d/forum/openwisp/join,https://gitter.im/openwisp/general,https://twitter.com/openwisp,,"iot, networking, wifi, configu, telecom","python, javascript, django, openwrt, ansible"
2019,Oppia Foundation,Web,"Collaborative tools for creating free, effective and enjoyable online lessons",https://github.com/oppia/oppia,4,https://summerofcode.withgoogle.com/archive/2019/organizations/6170718394384384/,mailto:oppia-gsoc-discuss@googlegroups.com,https://github.com/oppia/oppia/wiki/Google-Summer-of-Code-2019#communication,https://github.com/oppia/oppia/wiki/Google-Summer-of-Code-2019#communication,,https://medium.com/oppia-org,"education, web development, community, interactive, tools","python, javascript, angularjs, css, app engine"
2019,OSGeo,Other,The Open Source Geospatial Foundation,https://osgeo.org,7,https://summerofcode.withgoogle.com/archive/2019/organizations/6684630290268160/,mailto:gsoc-admin@osgeo.org,https://www.osgeo.org/community/communications/,https://wiki.osgeo.org/wiki/Google_Summer_of_Code_Recommendations_for_Students#How_to_get_in_contact_via_IRC,https://twitter.com/osgeo,http://planet.osgeo.org,"geoinformatics, computer vision, gis, maps, geolocation","python, c/c++, java, sql, open source databases"
2019,OWASP Foundation,Security,"OWASP, The Open Web Application Security Project.",https://www.owasp.org,12,https://summerofcode.withgoogle.com/archive/2019/organizations/5214459562295296/,mailto:owasp-gsoc@googlegroups.com,https://groups.google.com/forum/#!forum/owasp-gsoc,https://owasp.slack.com/messages/CFJLZNFN1,https://twitter.com/owasp,http://owasp.blogspot.com/,"security, secure development, appsec, application security, sdlc","python, javascript, java, php"
2019,PEcAn Project,Science and medicine,"Ecosystem science, policy, and management informed by the best  data and models",http://pecanproject.org,2,https://summerofcode.withgoogle.com/archive/2019/organizations/5919891029229568/,mailto:pecanproj@gmail.com,,https://join.slack.com/t/pecanproject/shared_invite/enQtMzkyODUyMjQyNTgzLTYyZTZiZWQ4NGE1YWU3YWIyMTVmZjEyYzA3OWJhYTZmOWQwMDkwZGU0Mjc4Nzk0NGYwYTIyM2RiZmMyNjg5MTE,https://twitter.com/pecanproject?lang=en,,"data science, ecosystem models, scientific visualization, ecological forecasting, climate science","python, postgresql, r, docker, singularity"
2019,Percona,Data,Unbiased open source database experts.,http://www.percona.com,2,https://summerofcode.withgoogle.com/archive/2019/organizations/4926515777634304/,mailto:gsoc@percona.com,https://groups.google.com/forum/#!forum/percona-gsoc,,,http://www.percona.com/blog,"database optimization, metrics, testing, monitoring, databases","mysql, postgresql, prometheus, javascript, selenium"
2019,Performance Co-Pilot,Operating systems,Performance Co-Pilot - system-level performance analysis toolkit,https://pcp.io,2,https://summerofcode.withgoogle.com/archive/2019/organizations/5769836615958528/,mailto:pcp-mentors@groups.io,https://groups.io/g/pcp,https://pcp.io/community.html,https://twitter.com/performancepcp,,"visualization, web development, performance, kernel, high performance computing","c, python, linux, javascript, redis"
2019,Pharo Consortium,Programming languages,The immersive programming experience,https://pharo.org/,7,https://summerofcode.withgoogle.com/archive/2019/organizations/6725431019962368/,,http://pharo-dev@lists.pharo.org,https://discordapp.com/invite/QewZMZa,https://twitter.com/pharoproject,https://pharo.org/news,"web development, data science, nlp, cli, material design","ide, smalltalk, pharo, squeak, os"
2019,phpMyAdmin,Data,A web interface for MySQL written in PHP,https://www.phpmyadmin.net,2,https://summerofcode.withgoogle.com/archive/2019/organizations/5607768440963072/,mailto:developers@phpmyadmin.net,https://lists.phpmyadmin.net/mailman/listinfo/developers,,,https://planet.phpmyadmin.net/,"database, web applications, mysql, developer, administrator","mysql, javascript, bootstrap, php, cakephp"
2019,Pitivi,Media,Allowing everyone on the planet to express themselves through filmmaking,http://pitivi.org/,3,https://summerofcode.withgoogle.com/archive/2019/organizations/5637551623241728/,mailto:pitivi@pitivi.org,,http://www.pitivi.org/?go=contact,https://twitter.com/pitivi,http://www.pitivi.org/planet/,"video processing, filmmaking, video editing","c, gtk, python 3, gstreamer"
2019,PostgreSQL,Data,The World's Most Advanced Open Source Database,https://www.postgresql.org,4,https://summerofcode.withgoogle.com/archive/2019/organizations/5190353336926208/,mailto:pgsql-hackers@lists.postgresql.org,https://lists.postgresql.org,https://www.postgresql.org/community/irc/,https://twitter.com/PostgreSQL,https://planet.postgresql.org,"database, big data, data","c, postgresql, sql, rdbms"
2019,Project PANOPTES,Science and medicine,Discover New Worlds,https://projectpanoptes.org,2,https://summerofcode.withgoogle.com/archive/2019/organizations/5716618817044480/,mailto:gsoc@projectpanoptes.org,https://forum.projectpanoptes.org/c/GSoC-2019,,,,"robotics, image processing, astronomy, exoplanet","python 3, arduino, cloud"
2019,Public Lab,Science and medicine,Open hardware and software to help communities measure and analyze pollution,https://publiclab.org,12,https://summerofcode.withgoogle.com/archive/2019/organizations/5206886662537216/,mailto:web@publiclab.org,https://publiclab.org/lists,https://publiclab.org/chat,https://twitter.com/PublicLab,https://publiclab.org/blog,"science, environment, collaboration, community, hardware","javascript, ruby on rails, node.js, raspberry pi"
2019,Purr Data,Programming languages,Visual Programming Language for Realtime Multimedia,https://www.purrdata.net/,1,https://summerofcode.withgoogle.com/archive/2019/organizations/4920428332580864/,mailto:l2ork-dev@disis.music.vt.edu,http://disis.music.vt.edu/cgi-bin/mailman/listinfo/l2ork-dev,,,,"data visualization, audio, video, digital signal processing, real-time system","javascript, c/c++, html5, node.js"
2019,Python Software Foundation,Science and medicine,Python is a programming language used by software developers and scientists.,https://www.python.org/,30,https://summerofcode.withgoogle.com/archive/2019/organizations/4923862075047936/,mailto:gsoc-general@python.org,https://mail.python.org/mailman/listinfo/gsoc-general,http://python-gsoc.org/index.html#contact,https://twitter.com/thepsf,http://pyfound.blogspot.com/,"programming languages, science",python
2019,QEMU,Infrastructure and cloud,Open source machine emulator and virtualizer,https://www.qemu.org/,3,https://summerofcode.withgoogle.com/archive/2019/organizations/6510621636427776/,mailto:qemu-devel@nongnu.org,https://wiki.qemu.org/Contribute/MailingLists,https://webchat.oftc.net/?nick=&channels=%23qemu-gsoc&uio=d4,,https://www.qemu.org/blog/,"lowlevel, emulator, hypervisor, code generation","c, linux, kvm, virtualization"
2019,R project for statistical computing,Programming languages,R is a free software environment for statistical computing and graphics,https://www.r-project.org/,30,https://summerofcode.withgoogle.com/archive/2019/organizations/5218980686462976/,mailto:gsoc-r@googlegroups.com,https://github.com/rstats-gsoc/gsoc2019/wiki,,,http://www.r-bloggers.com/,"visualization, machine learning, data science, graphics, statistics","c, javascript, c++, r-project, fortran"
2019,ReactOS,Operating systems,Open your windows to freedom!,https://reactos.org,2,https://summerofcode.withgoogle.com/archive/2019/organizations/5356941075808256/,,https://reactos.org/mailman/listinfo/ros-dev,https://chat.reactos.org,https://twitter.com/reactos,https://reactos.org/blog,"operating systems, kernel, web services, drivers, windows","c, c++, php, win32, nt"
2019,Read the Docs,Programming languages,Documentation Simplified,https://readthedocs.org,2,https://summerofcode.withgoogle.com/archive/2019/organizations/5033715393101824/,mailto:team@readthedocs.org,,https://docs.readthedocs.io/en/latest/contribute.html?highlight=irc#get-in-touch,https://twitter.com/readthedocs,https://blog.readthedocs.com/,"web, documentation","python, django, documentation, sphinx"
2019,Red Hen Lab,Science and medicine,Research on Multimodal Communication,http://redhenlab.org,15,https://summerofcode.withgoogle.com/archive/2019/organizations/4781629350871040/,mailto:redhenlab@gmail.com,,http://redhen-gsoc.slack.com,https://twitter.com/redhenlab,,"big data, ai, multimedia, communication, cognitive science","python, machine learning, opencv, nlp, asr"
2019,RoboComp,Other,An open-source framework to develop and manage robot components.,http://robocomp.org,10,https://summerofcode.withgoogle.com/archive/2019/organizations/6183862000943104/,mailto:ljmanso@ljmanso.com,https://groups.google.com/forum/?hl=en#!forum/robocomp-dev,,,,"robotics, computer vision, multi-agent system, component-based development","python, opencv, qt, c++11, component-based development"
2019,Rocket.Chat,Social and communication,The ultimate open source team chat and collaboration platform,https://github.com/RocketChat/Rocket.Chat,15,https://summerofcode.withgoogle.com/archive/2019/organizations/5613954468937728/,mailto:gsoc@rocket.chat,,https://open.rocket.chat,https://twitter.com/rocketchat,https://rocket.chat/blog/,"collaboration, instant messaging, realtime communications, chat, chatbot","javascript, android, react, node.js, ios"
2019,RTEMS Project,Operating systems,RTEMS is a real-time operating system kernel used around the world and in space.,https://www.rtems.org/,4,https://summerofcode.withgoogle.com/archive/2019/organizations/4579649638629376/,mailto:gsoc@rtems.org,https://devel.rtems.org/wiki/RTEMSMailingLists,https://devel.rtems.org/wiki/Developer/IRC,,,"embedded systems, real time, kernel, multicore, iot cps","python, c/c++, assembly, posix, bsd unix"
2019,Ruby,Programming languages,The Ruby programming language and other libraries,https://ruby-lang.org,5,https://summerofcode.withgoogle.com/archive/2019/organizations/6496971961925632/,,,http://slack.bundler.io,,,"programming languages, developer tools, web servers","c, ruby"
2019,Ruby Science Foundation,Science and medicine,Tools for scientific computation in Ruby,http://sciruby.com/,2,https://summerofcode.withgoogle.com/archive/2019/organizations/6207728010133504/,mailto:sciruby-dev@googlegroups.com,https://groups.google.com/forum/#!forum/sciruby-dev,http://sciruby.com,https://twitter.com/sciruby,http://sciruby.com/blog/,"scientific computing, linear algebra, scientific visualization, data-science, hpc","c/c++, machine learning, ruby, cuda, ai"
2019,SageMath,Science and medicine,open-source mathematics software system,https://www.sagemath.org/,4,https://summerofcode.withgoogle.com/archive/2019/organizations/4925411685826560/,mailto:harald+gsoc@schil.ly,https://groups.google.com/group/sage-gsoc/,,https://twitter.com/sagemath,http://planet.sagemath.org/,"mathematics, education, research, math","python, cython"
2019,Salesforce,Infrastructure and cloud,"From the kernel to the browser, open source projects from Salesforce.",https://opensource.salesforce.com/,2,https://summerofcode.withgoogle.com/archive/2019/organizations/5996747724161024/,mailto:oss-gsoc@salesforce.com,,,https://twitter.com/salesforceeng,https://engineering.salesforce.com/,"machine learning, natural language processing, web applications, user interface, cli","javascript, react, nodejs, scala, apache spark"
2019,Samba,Data,Samba is the standard Windows interoperability suite of programs for Linux/Unix.,https://www.samba.org/,1,https://summerofcode.withgoogle.com/archive/2019/organizations/4908878360215552/,mailto:samba-technical@lists.samba.org,https://lists.samba.org/,https://www.samba.org/samba/irc.html,,https://www.samba.org/samba/latest_news.html,networking,"c, smb"
2019,SCoRe Lab (Sustainable Computing Research Lab),Security,"SCoRe has conducted research covering various aspects of Security, Mobile & IOT.",http://www.scorelab.org/,27,https://summerofcode.withgoogle.com/archive/2019/organizations/4922378566500352/,mailto:info@scorelab.org,https://groups.google.com/forum/#!forum/score-community,https://gitter.im/scorelab/scorelab,https://twitter.com/scoreucsc,http://www.scorelab.org/blog/index.html,"machine learning, web development, cloud, information security, mobile","python, android, nodejs, golang"
2019,ScummVM,Other,ScummVM is a GSoC umbrella for game preservation projects,http://www.scummvm.org,3,https://summerofcode.withgoogle.com/archive/2019/organizations/5793284520148992/,mailto:admin@scummvm.org,http://wiki.scummvm.org/index.php/Summer_of_Code/GSoC_Contact,http://wiki.scummvm.org/index.php/Summer_of_Code/GSoC_Contact,https://twitter.com/scummvm,http://planet.scummvm.org/,"games, game engines, software preservation, software archeology","c/c++, opengl, lua, assembly, sdl"
2019,shogun.ml,Science and medicine,Unified and efficient Machine Learning,http://shogun.ml/,1,https://summerofcode.withgoogle.com/archive/2019/organizations/5700571963588608/,mailto:heiko.strathmann@gmail.com,http://shogun.ml,http://webchat.freenode.net/?channels=shogun&uio=d4,https://twitter.com/shoguntoolbox,,"machine learning, software engineering, data science, scientific computing, user experience","python, cmake, c++11, c++17, swig"
2019,Software and Computational Systems Lab at LMU Munich,Programming languages,"Software Analysis, Software Verification, and Benchmarking",https://www.sosy-lab.org/,2,https://summerofcode.withgoogle.com/archive/2019/organizations/5660544999096320/,mailto:info@sosy-lab.org,,,,,"software analysis, software verification, benchmarking, smt solver, result presentation","python, javascript, java"
2019,Software Heritage,Data,The Great Library of Source Code,https://www.softwareheritage.org,3,https://summerofcode.withgoogle.com/archive/2019/organizations/5852998071222272/,mailto:swh-devel@inria.fr,https://www.softwareheritage.org/community/developers/,https://www.softwareheritage.org/community/developers/,https://twitter.com/swheritage,https://www.softwareheritage.org/blog/,"big data, digital preservation, big code, source code archive, free and open source software","python, javascript, django, git, postgres"
2019,SPDX (Software Product Data Exchange),Programming languages,Promoting open source compliance through standard communication of SW licenses.,https://spdx.org/,8,https://summerofcode.withgoogle.com/archive/2019/organizations/6051311592669184/,mailto:spdx-tech@lists.spdx.org,https://spdx.org/participate,https://gitter.im/spdx-org,,,"compliance, open source, licensing","python, java, golang, xml"
2019,strace,Operating systems,linux syscall tracer,https://strace.io,2,https://summerofcode.withgoogle.com/archive/2019/organizations/5915389047865344/,mailto:strace-devel@lists.strace.io,https://lists.strace.io/mailman/listinfo/strace-devel,https://strace.io,,,"debugging, tracing, diagnostic","c, linux, shell script, make, awk"
2019,Submitty,Other,Programming assignment submission with automated grading and manual TA grading,http://submitty.org,4,https://summerofcode.withgoogle.com/archive/2019/organizations/6109881407373312/,mailto:submitty-admin@googlegroups.com,https://submitty.org/developer,https://join.slack.com/t/submitty/shared_invite/enQtMzE1NzgyMzUzNzI5LWNkNjUzYmZjOWJkNzdlM2QzNTM3MGYwNmQwMzQ3NjAwODUwYjI4MTRlZDNjZTFlMTk4ZjUzN2MxNzRjNDIwZTU,,,"education, web, data visualization, privacy/security, communication","python, postgresql, javascript, c++, php"
2019,Sugar Labs,End user applications,"Sugar is an activity-focused, open-source learning platform for children.",https://sugarlabs.org,8,https://summerofcode.withgoogle.com/archive/2019/organizations/5488361639247872/,mailto:walter@sugarlabs.org,http://lists.sugarlabs.org/listinfo/sugar-devel,https://github.com/sugarlabs/GSoC#how-to-talk-to-us-,,,education,"python, javascript"
2019,Swift,Programming languages,Swift is a high-performance application and system programming language.,https://swift.org,1,https://summerofcode.withgoogle.com/archive/2019/organizations/6407128493850624/,,https://swift.org/community/#forums,,https://twitter.com/swiftlang,https://swift.org/blog/,programming,"swift, ios, programming languages, compilers, server"
2019,SymbiFlow,Programming languages,A completely FOSS toolchain for FPGAs.,https://symbiflow.github.io,1,https://summerofcode.withgoogle.com/archive/2019/organizations/6469457059250176/,,https://lists.librecores.org/listinfo,https://webchat.freenode.net/?channels=symbiflow,,,"electronic design tools, programming languages and development tools","verilog, fpga, xilinx"
2019,SymPy,Science and medicine,SymPy is a Python library for symbolic mathematics.,https://www.sympy.org/,10,https://summerofcode.withgoogle.com/archive/2019/organizations/5652307671252992/,,https://groups.google.com/forum/#!forum/sympy,https://gitter.im/sympy/sympy,https://twitter.com/sympy,https://planet.sympy.org,"math, computer algebra",python
2019,Synfig,Media,Open-source 2D animation software,https://www.synfig.org/,2,https://summerofcode.withgoogle.com/archive/2019/organizations/5485328519921664/,mailto:contact@synfig.org,https://forums.synfig.org/c/development,,https://twitter.com/Synfig/,https://www.synfig.org/news/,"animation, vector graphics","c++, gtk, gtkmm"
2019,syslog-ng,Other,Open source log management solution with over a million users worldwide.,https://www.syslog-ng.com/,2,https://summerofcode.withgoogle.com/archive/2019/organizations/5114387092733952/,mailto:syslog-ng@lists.balabit.hu,https://lists.balabit.hu/mailman/listinfo/syslog-ng,https://gitter.im/balabit/syslog-ng,https://twitter.com/sngose,https://www.syslog-ng.com/community/,"build tools, log management, high performance data processing, data processing pipeline, reliable log transfer","c, python, json, rest, elasticsearch"
2019,TensorFlow,Other,An open-source machine learning framework for everyone.,https://www.tensorflow.org,19,https://summerofcode.withgoogle.com/archive/2019/organizations/6672831360794624/,mailto:webpaige@google.com,https://github.com/tensorflow/community,https://gitter.im/tensorflow/gsoc,https://twitter.com/TensorFlow,https://medium.com/tensorflow,"machine learning, data science, deep learning, python, data","python, c/c++, machine learning, data analysis, deep learning"
2019,The Apache Software Foundation,Other,Providing open source software to the public free of charge,https://www.apache.org,17,https://summerofcode.withgoogle.com/archive/2019/organizations/5617445421711360/,mailto:mentors@community.apache.org,http://apache.org/foundation/mailinglists.html,https://wiki.apache.org/general/IRC,https://twitter.com/TheASF,https://blogs.apache.org/,"big data, cloud, libraries","c/c++, java"
2019,The Center for Connected Learning and Computer-Based Modeling,Programming languages,NetLogo: A language and IDE for programming and scientific simulations,http://ccl.northwestern.edu/netlogo,1,https://summerofcode.withgoogle.com/archive/2019/organizations/6614261546090496/,,,https://gitter.im/NetLogo/GSoC,,,"education, research, programming languages, simulation","javascript, scala"
2019,The Eclipse Foundation,Programming languages,The Platform for Open Innovation and Collaboration,http://www.eclipse.org,10,https://summerofcode.withgoogle.com/archive/2019/organizations/4793126693109760/,mailto:emo@eclipse.org,https://accounts.eclipse.org/mailing-list/soc-dev,https://wiki.eclipse.org/IRC,https://twitter.com/EclipseFdn,https://planet.eclipse.org,"iot, cloud, ide","javascript, java, jakarta, openj9"
