year,name,category,description,url,num_projects,projects_url,contact_email,mailing_list,irc_channel,twitter_url,blog_url,topics,technologies
2019,The GNU Project,Operating systems,GNU is an operating system that is free software and respects users' freedom,http://www.gnu.org,5,https://summerofcode.withgoogle.com/archive/2019/organizations/5352439094444032/,,https://lists.gnu.org/mailman/listinfo/summer-of-code,,,,"gnu, free software",operating systems
2019,The Honeynet Project,Security,The Honeynet Project - R&D for Honeypot/Honeynet Technology and InfoSec Research,https://honeynet.org/,9,https://summerofcode.withgoogle.com/archive/2019/organizations/6462296409243648/,mailto:project@honeynet.org,,https://gsoc-slack.honeynet.org/,https://twitter.com/ProjectHoneynet,https://honeynet.org/blog,"research, honeypots, deception, malware, honeynets","python, linux, c/c++, go, data analysis"
2019,The Java Pathfinder Team,Programming languages,An extensible software analysis framework for Java bytecode,https://github.com/javapathfinder,6,https://summerofcode.withgoogle.com/archive/2019/organizations/4859784585543680/,,https://groups.google.com/forum/#!forum/java-pathfinder,,,,"testing, concurrency, program analysis, virtual machine, software model checking","android, java, distributed systems, jvm, bytecode"
2019,The Julia Language,Science and medicine,A fresh approach to Technical Computing,http://www.julialang.org,13,https://summerofcode.withgoogle.com/archive/2019/organizations/4615767377575936/,mailto:summerofcode@julialang.org,https://discourse.julialang.org/,https://julialang.org/community/,https://twitter.com/JuliaLanguage,https://julialang.org/blog/,"machine learning, data science, scientific computing, numerical computing, technical computing",julia
2019,The Libreswan Project,Security,Encrypting the Internet with IKE and IPsec.,https://libreswan.org/,1,https://summerofcode.withgoogle.com/archive/2019/organizations/4734236785901568/,mailto:gsoc@libreswan.org,http://lists.libreswan.org,https://libreswan.org/wiki/IRC,https://twitter.com/libreswan/,,"vpn, ipsec, encryption, ikev2","c, python, web, virtualization, nss"
2019,The Linux Foundation,Operating systems,A non-profit consortium dedicated to fostering the growth of Linux,http://www.linuxfoundation.org/,7,https://summerofcode.withgoogle.com/archive/2019/organizations/6487994943406080/,mailto:till@linux.com,https://wiki.linuxfoundation.org/gsoc/google-summer-code-2019#if_you_have_questions,https://wiki.linuxfoundation.org/gsoc/google-summer-code-2019#if_you_have_questions,,,"wireless, automotive, printing, lsb, spdx","c, c++, cups, ipp"
2019,The Mifos Initiative,End user applications,End Poverty One Line of Code at a Time,https://mifos.org,14,https://summerofcode.withgoogle.com/archive/2019/organizations/4585661988864000/,mailto:info@mifos.org,https://mifos.org/resources/community/communications/,https://gitter.im/openMF/mifos,https://twitter.com/mifos,https://mifos.org/blog,"web, cloud, ai, fintech, mobile banking","mysql, android, java, spring, angular"
2019,The NetBSD Foundation,Operating systems,Of course it runs NetBSD,https://www.NetBSD.org/,7,https://summerofcode.withgoogle.com/archive/2019/organizations/6058884492427264/,mailto:gsoc-admin@NetBSD.org,https://www.netbsd.org/mailinglists/,https://wiki.netbsd.org/community/,https://twitter.com/netbsd,https://blog.NetBSD.org/,"kernel, packaging, userland, unix, bsd","c, make, bsd"
2019,The ns-3 Network Simulator Project,Other,ns-3 is a packet-level network simulator for research and education.,https://www.nsnam.org,4,https://summerofcode.withgoogle.com/archive/2019/organizations/5495934539005952/,mailto:consortium@nsnam.org,https://www.nsnam.org/support/mailing-lists/,https://ns-3.zulipchat.com,,,"networking, research and development","python, c/c++"
2019,The Perl Foundation,Programming languages,Devoted to the advancement of the Perl languages through discussion and code,https://perlfoundation.org,4,https://summerofcode.withgoogle.com/archive/2019/organizations/6559697677582336/,mailto:mdk@perlfoundation.org,https://lists.perl.org/,https://www.irc.perl.org/,https://twitter.com/@perlfoundation,http://news.perlfoundation.org/,"functional programming, concurrency, web services, natural language understanding, programming languages and development tools","c, perl, regular expressions, perl6, perl5"
2019,The Postgres Operator,Data,A project to create an open-sourced managed Postgresql service for Kubernetes,https://github.com/zalando-incubator/postgres-operator,1,https://summerofcode.withgoogle.com/archive/2019/organizations/6187982082539520/,mailto:team-acid@zalando.de,,https://postgresteam.slack.com/messages/CFYAXFT7D/,,,"databases, cloud, cloud databases, cloud native, database services","postgresql, golang, kubernetes, operator, patroni"
2019,The Processing Foundation,Programming languages,Our goal is to empower people of all backgrounds to learn how to program.,http://processingfoundation.org,16,https://summerofcode.withgoogle.com/archive/2019/organizations/5422734538964992/,mailto:foundation@processing.org,,https://discourse.processing.org/c/summer-of-code,https://twitter.com/processingorg,https://medium.com/processing-foundation,"education, web, graphics, creative coding, design","python, javascript, android, java, opengl"
2019,The Terasology Foundation,End user applications,Voxel world game/engine with a large focus on extensibility and developer tools,https://terasology.org/,9,https://summerofcode.withgoogle.com/archive/2019/organizations/5741667284418560/,mailto:terasology@gmail.com,https://forum.terasology.org/forum/,https://github.com/MovingBlocks/Terasology/wiki/Using-IRC,https://twitter.com/Terasology,https://terasology.org/,"game, minecraft, sandbox, modding, ai","java, opengl, blender, gradle, lwjgl"
2019,The Vega Project at the University of Washington,Web,"Declarative formats & Applications for Creating, Saving & Sharing Visualizations",http://vega.github.io/,2,https://summerofcode.withgoogle.com/archive/2019/organizations/5953843416793088/,,https://bit.ly/vega-discuss,https://bit.ly/join-vega-slack,https://twitter.com/vega_vis,http://medium.com/@uwdata,"visualization, data-science","react, d3, typescript, vega, vega-lite"
2019,The Wine Project,Other,"Wine runs Windows applications on Linux, BSD, Solaris, macOS and Android.",https://www.winehq.org/,0,https://summerofcode.withgoogle.com/archive/2019/organizations/4848751686975488/,,https://www.winehq.org/mailman/listinfo/wine-devel,https://www.winehq.org/irc,,https://plus.google.com/118270494377292768160,"3d, desktop integration, compatibility, directx, opengl","c, opengl, x11, win32, directx"
2019,TimVideos.us,Media,"Software & hardware for recording + streaming conferences, meetings, user groups",https://code.timvideos.us,0,https://summerofcode.withgoogle.com/archive/2019/organizations/6213357017759744/,mailto:contact@timvideos.su,https://groups.google.com/forum/#!forum/timvideos/join,http://webchat.freenode.net/?channels=%23timvideos,https://twitter.com/TimVideosUs,https://hdmi2usb.tv/news/,"hardware, embedded, video, fpga","c, python, verilog, fpga, vhdl"
2019,Tokio,Programming languages,The asynchronous run-time for the Rust programming language.,https://tokio.rs,1,https://summerofcode.withgoogle.com/archive/2019/organizations/6043030627287040/,mailto:carl@buoyant.io,https://tokio.rs/,https://gitter.im/tokio-rs/gsoc,https://twitter.com/tokio_rs,https://tokio.rs/,"concurrency, networking, windows, rust","rust, tokio_rs"
2019,Tungsten Fabric,Infrastructure and cloud,"Secure software defined networking for any cloud, anywhere.",https://tungsten.io,1,https://summerofcode.withgoogle.com/archive/2019/organizations/5098459072299008/,mailto:dev@lists.tungsten.io,https://tungsten.io/community/,https://tungsten.io/community/,https://twitter.com/tungstenfabric,,"security, software defined networking, routing, multicloud","python, linux, c/c++, networking, kubernetes"
2019,UCSC Xena,Science and medicine,Helping biologists see the bigger picture in diverse cancer genomics data,http://xena.ucsc.edu,1,https://summerofcode.withgoogle.com/archive/2019/organizations/4731456398557184/,mailto:genome-cancer@soe.ucsc.edu,https://groups.google.com/forum/#!forum/xena-google-summer-of-code,,https://twitter.com/ucscxena,,"genomics, bioinformatics, scientific visualization, cancer research","python, javascript, react, clojure"
2019,VideoLAN,Media,VideoLAN is a team of volunteers believing in FOSS to rock the multimedia world.,https://www.videolan.org,9,https://summerofcode.withgoogle.com/archive/2019/organizations/6597728220479488/,mailto:videolan@videolan.org,https://mailman.videolan.org/listinfo/vlc-devel,https://www.videolan.org/support/,https://twitter.com/videolan,https://planet.videolan.org,"web, graphics, video, multimedia, codecs","c, opengl, c++, qt, assembly"
2019,webpack,Web,webpack is THE build tool for modern web applications run on NodeJS,https://webpack.js.org/,2,https://summerofcode.withgoogle.com/archive/2019/organizations/5974651593818112/,mailto:webpack@opencollective.com,,http://webpack.js.org,https://twitter.com/webpack,https://medium.com/webpack,"compilers, programming languages and development tools, tooling, parser, toolchains","javascript, node.js, web development, html5/css3, webasssembly"
2019,Wikimedia Foundation,Web,Global movement whose mission is to bring free educational content to the world,http://wikimediafoundation.org/,11,https://summerofcode.withgoogle.com/archive/2019/organizations/6727339445059584/,mailto:wikitech-l@lists.wikimedia.org,https://lists.wikimedia.org/mailman/listinfo/wikitech-l,https://wikimedia.zulipchat.com/#narrow/stream/180873-gsoc19-outreachy18,https://twitter.com/Wikimedia,https://wikimediafoundation.org/news/,"semantic web, wikipedia, wikimedia, mediawiki, i18n","python, javascript, html, php, css"
2019,X.Org Foundation,Media,"X Window System and related projects (Mesa, DRI, Wayland, etc.)",http://www.x.org,2,https://summerofcode.withgoogle.com/archive/2019/organizations/4999753610297344/,mailto:dri-devel@lists.freedesktop.org,https://www.x.org/wiki/SummerOfCodeIdeas/,https://www.x.org/wiki/SummerOfCodeIdeas/,https://twitter.com/xorgfoundation?lang=en,https://planet.freedesktop.org/,"graphics stack, 3d acceleration, media acceleration, 2d acceleration, windowing system","opengl, vulkan, x11, wayland, opencl"
2019,Xapian Search Engine Library,Data,"Fast, scalable and flexible search",https://xapian.org/,3,https://summerofcode.withgoogle.com/archive/2019/organizations/5711561895706624/,,https://trac.xapian.org/wiki/GSoC_Mailing_List,https://trac.xapian.org/wiki/GSoC_IRC,,,"machine learning, search, information retrieval, linguistics, indexing","linux, c++, unicode, swig"
2019,Xi Editor,End user applications,A modern text editor with a backend written in Rust.,https://xi-editor.io/,1,https://summerofcode.withgoogle.com/archive/2019/organizations/4795917817872384/,mailto:mods@xi-exitor.io,https://www.reddit.com/r/xi_editor/,https://xi.zulipchat.com/,,https://xi-editor.io/updates.html,"ide, text editor, end user application","rust, swift"
2019,XMPP Standards Foundation (XSF),Social and communication,Secure and federated communication with open standards,https://xmpp.org,3,https://summerofcode.withgoogle.com/archive/2019/organizations/5008573141090304/,,https://mail.jabber.org/mailman/listinfo/gsoc,https://wiki.xmpp.org/web/GSoC/2019#Join_the_group_chat.21,https://twitter.com/xmpp,https://xmpp.org/blog,"instant messaging, realtime communications, machine-to-machine, internet of things, xmpp","java, lua, asynchronous i/o, xmpp, python 3"
2019,xpra,Media,"screen for X11, remote access for MS Windows and Mac OS",https://xpra.org/,0,https://summerofcode.withgoogle.com/archive/2019/organizations/6320987639906304/,mailto:info@xpra.org,https://lists.devloop.org.uk/mailman/listinfo/shifter-users,http://irc.freenode.net/winswitch,,,"desktop, video, remote-access, seamless","c, python, javascript"
2019,XWiki,Web,The Advanced Open Source Enterprise Wiki,http://www.xwiki.org/,3,https://summerofcode.withgoogle.com/archive/2019/organizations/6134473047932928/,mailto:committers@xwiki.org,http://dev.xwiki.org/xwiki/bin/view/Community/Discuss#HMailingLists,http://dev.xwiki.org/xwiki/bin/view/Community/Chat,https://twitter.com/xwikiorg,http://www.xwiki.org/xwiki/bin/Blog/,"web development, wiki, platform, web applications, structured data","javascript, java, html5, css3, velocity"
2019,Zulip Open Source Project,Social and communication,"Powerful, modern, open source team chat, complete with apps for every platform.",https://zulipchat.com,17,https://summerofcode.withgoogle.com/archive/2019/organizations/4652389204754432/,,,https://chat.zulip.org/,https://twitter.com/zulip,https://blog.zulip.org/,"mobile, great developer tooling, chat, visual design, bots","python, javascript, django, react native, electron"
2019,ZynAddSubFX,Media,An open source musical software synthesizer with a wide range of possibilities,http://zynaddsubfx.sf.net,1,https://summerofcode.withgoogle.com/archive/2019/organizations/5486812028469248/,,http://zynaddsubfx.sourceforge.net/support.html,http://zynaddsubfx.sourceforge.net/support.html,,,"visualization, music, audio, digital signal processing, user experience","c/c++, opengl, ruby, midi, open-sound-control"
